Scholarship_Name,Scholarship_Type,Country,Funding_Level,Funding_Details,Application_Mode,Application_Month,Start_Date,End_Date,Quantity,For_Vietnamese,Eligibility,Field_Restriction,Eligible_Fields,Required_Degree,Min_Gpa,Bachelor_Ranking_Requirement,Bachelor_Field_Relevance,Experience_Years,Min_Working_Hours,Language_Certificate,Academic_Certificate,Awards_Requirement,Publication_Requirement,Age,Gender,Special_Circumstances,Career_Plan,Other_Requirements,Scholarship_Info,Application_Documents,Timeline,Url,Checked
International Cultural Service Program (ICSP) Scholarship - University of Oregon,Trường,Hoa Kỳ,Bán phần,Gia hạn hằng năm đến khi hoàn thành bằng nếu đáp ứng yêu cầu ICSP.,Thường niên,1,2026-01-16 00:00:00,2026-02-14 07:00:00,,True,"sinh viên quốc tế có nhu cầu tài chính, thành tích xuất sắc, không phải công dân/ thường trú nhân Hoa Kỳ và không đủ điều kiện nhận hỗ trợ tài chính liên bang Hoa Kỳ.",Không,,Bằng Cử nhân,3.0/4.0,Không,Yêu cầu chặt chẽ,0.0,0.0,Không có thông tin,Không bắt buộc,"Không, Có sẽ được đánh giá rất cao",Không,Không yêu cầu,Không yêu cầu,,,"Hoạt động cộng đồng, Tư duy cộng đồng, Hoàn cảnh tài chính","Sinh viên quốc tế có nhu cầu tài chính và thành tích xuất sắc có thể đăng ký Học bổng Chương trình Dịch vụ Văn hóa Quốc tế (ICSP). Học bổng ICSP bao gồm một thành phần dịch vụ văn hóa, yêu cầu sinh viên thuyết trình về đất nước của mình cho trẻ em, tổ chức cộng đồng, sinh viên, giảng viên và nhân viên UO. Người nhận học bổng ICSP sẽ được miễn giảm một phần học phí, học bổng được gia hạn hằng năm cho đến khi hoàn thành bằng tại UO nếu đáp ứng các yêu cầu của chương trình.","Đơn nhập học vào University of Oregon (trước 15/01/2026)
Hồ sơ học bổng tại UO Scholarship Dashboard (Profile, ISSS Endowed Scholarships Application, ICSP Scholarship Application)
Thư giới thiệu (reference letters)
Bằng cấp, bảng điểm
Chứng minh tài chính
Tài liệu về hoạt động văn hóa, kỹ năng giao tiếp (nếu có)","Hạn nộp đơn nhập học UO: 16/01/2026
Hạn nộp học bổng ICSP: 14/02/2026, 07:00 sáng (VN time)",https://isss.uoregon.edu/icsp/application,
Commonwealth Master’s Scholarships for Developing Commonwealth Countries,Chính phủ,Anh,"Toàn phần, Sinh hoạt phí, Chi phí khác, Trợ cấp học tập","vé máy bay khứ hồi, học phí, phí thi, trợ cấp sinh hoạt £1,378/tháng hoặc £1,690/tháng tại London, trợ cấp nghiên cứu, trợ cấp quần áo ấm, và các hỗ trợ khác",Thường niên,,,2025-10-14 22:00:00,,False,"chỉ dành cho các nước thuộc khối Commonwealth đủ điều kiện, Việt Nam không thuộc nhóm này",Không,,Bằng Cử nhân,Thành tích học tập xuất sắc,Không,Yêu cầu chặt chẽ,0.0,0.0,"Tùy khóa học, Tiếng Anh",Không bắt buộc,Không,Không,Không yêu cầu,Không yêu cầu,Có thể xét công dân hoặc người có quy chế tị nạn tại quốc gia Commonwealth,,"Hoạt động cộng đồng, Tác động xã hội, Đóng góp phát triển, Tầm nhìn","Học bổng Commonwealth dành cho bậc Thạc sĩ hoặc Tiến sĩ tại Vương quốc Anh được trao cho công dân các quốc gia đang phát triển thuộc Khối Thịnh vượng chung. Học bổng do Bộ Ngoại giao, Khối thịnh vượng chung và Phát triển Vương quốc Anh (FCDO) tài trợ, nhằm đáp ứng nhu cầu phát triển của các quốc gia này thông qua việc hỗ trợ nghiên cứu có tác động phát triển.","Đơn ứng tuyển qua hệ thống CSC’s Electronic Application System (EAS)
Đơn ứng tuyển riêng theo yêu cầu của nominating body (tổ chức đề cử quốc gia hoặc NGO)
Bằng cấp, bảng điểm, giấy tờ chứng minh tình trạng công dân/tị nạn, thư giới thiệu, các tài liệu bổ sung theo yêu cầu","Hạn chót: 14/10/2025, 16:00 BST (22:00 giờ Việt Nam)
Các nominating body có thể có hạn riêng, ứng viên phải kiểm tra trực tiếp với họ",https://cscuk.fcdo.gov.uk/scholarships/commonwealth-masters-scholarships/,False
University of Geneva Excellence Masters Fellowships - University of Geneva,Trường,Thụy Sĩ,Khoản phí quy định,"10,000 – 15,000 CHF mỗi năm, học bổng cấp trong 1 năm và có thể gia hạn cho toàn bộ thời gian chương trình Thạc sĩ (3–4 học kỳ), nếu sinh viên đạt thành tích tốt sau học kỳ đầu tiên",Thường niên,1,,2026-03-01 05:59:59,,True,Phải được nhận vào một chương trình Master of Science của Faculty of Sciences. Được chọn dựa trên hồ sơ xin học bổng Excellence Fellowship riêng,Có,Các ngành thuộc Faculty of Sciences,"Bằng Cử nhân, Sắp tốt nghiệp",Thành tích học tập xuất sắc,Không,Yêu cầu chặt chẽ,0.0,0.0,"Tiếng Pháp, Tiếng Anh",Không bắt buộc,"Không, Thành tích học tập tốt",Không,Không yêu cầu,Không yêu cầu,,,,"Học bổng Excellence Masters Fellowships của Đại học Geneva (Thụy Sĩ) hỗ trợ tài chính cho sinh viên quốc tế xuất sắc theo học các chương trình thạc sĩ tại trường, đặc biệt trong lĩnh vực khoa học.","Đăng ký nhập học chương trình Master (theo hướng dẫn trên website Admissions)
Nộp hồ sơ xin học bổng Excellence Fellowship riêng
Hồ sơ trực tuyến mở từ tháng 1","Mở đơn: Tháng 1/2026
Deadline: 28/02/2026
Khóa học bắt đầu: Tháng 9/2026",https://www.unige.ch/sciences/en/enseignements/formations/masters/excellencemasterfellowships/,False
Swiss Government Excellence Scholarships (Art scholarships – Master’s degree),Chính phủ,Thụy Sĩ,"Toàn phần, Sinh hoạt phí, Chi phí khác","trợ cấp hàng tháng, miễn học phí, bảo hiểm y tế, hỗ trợ vé máy bay, phụ cấp nhà ở",Thường niên,8,2025-08-04 00:00:00,2025-09-15 00:00:00,,True,"chỉ dành cho ứng viên muốn học Master về lĩnh vực nghệ thuật, phải có giáo sư/giảng viên ở Thụy Sĩ đồng ý hướng dẫn nghiên cứu/đề án (điều kiện tiên quyết khi nộp hồ sơ).",Có,Artistic field,Bằng Cử nhân,Không yêu cầu,Không,Yêu cầu chặt chẽ,0.0,0.0,,Không bắt buộc,Không,Không,Không yêu cầu,Không yêu cầu,,,,Học bổng nghệ thuật mở cho sinh viên mong muốn theo học chương trình thạc sĩ đầu tiên trong lĩnh vực nghệ thuật tại Thụy Sĩ. Học bổng này chỉ dành cho sinh viên từ một số quốc gia nhất định.,"Phải có giảng viên/học thuật ở Thụy Sĩ đồng ý hướng dẫn.
Các biểu mẫu, tài liệu cụ thể sẽ được cung cấp trong country-specific fact sheet.","Mở đơn: 4/8/2025
Hạn nộp: tùy từng khu vực (ví dụ: Châu Âu 4/8/2025, Bắc Mỹ 27/8/2025, Châu Á 15/9/2025, Nam Mỹ 4/8/2025, …).",https://www.sbfi.admin.ch/en/swiss-government-excellence-scholarships,False
EPFL Excellence Fellowship -  École Polytechnique Fédérale de Lausanne,Trường,Thụy Sĩ,"Toàn phần, Sinh hoạt phí","Học phí + Sinh hoạt phí (CHF 10’000/semester + phòng ở ký túc xá, kéo dài tối đa 4 học kỳ cho bậc thạc s",Thường niên,,,2025-12-16 06:00:00,,True,,Có,Eligible Master’s Programme offered at University,Bằng Cử nhân,Thành tích học tập xuất sắc,Không,Yêu cầu chặt chẽ,0.0,0.0,Tùy khóa học,Không bắt buộc,"Không, Thành tích học tập tốt",Không,Không yêu cầu,Không yêu cầu,,,"Hoạt động ngoại khóa, Thành tích học tập",Học bổng Excellence Fellowship của EPFL (Thụy Sĩ) cung cấp hỗ trợ tài chính cạnh tranh cho sinh viên quốc tế xuất sắc theo học chương trình thạc sĩ tại trường.,"Nộp đơn online cùng với hồ sơ đăng ký chương trình thạc sĩ tại EPFL.
Đánh dấu chọn vào ô trong đơn ứng tuyển thạc sĩ để đăng ký xét học bổng.
Hồ sơ chi tiết cần theo hướng dẫn của EPFL Masters Fellowship Guidelines.",,https://www.epfl.ch/education/master/master-excellence-fellowships/,False
ARES Scholarships in Belgium for Developing Countries (UD ARES – Académie de Recherche et d’Enseignement Supérieur),"Quỹ, tổ chức",Bỉ,"Toàn phần, Sinh hoạt phí, Chi phí khác","học phí, chi phí đi lại quốc tế, trợ cấp sinh hoạt, phí đăng ký, chi phí visa, bảo hiểm, ...",Thường niên,,,2025-09-19 22:00:00,130.0,True,"chỉ dành cho công dân của 31 quốc gia đang phát triển bao gồm Africa (Benin, Burkina Faso, Burundi, Cameroon, Ethiopia, Guinea, Kenya, Madagascar, Mali, Morocco, Mozambique, Niger, DR Congo, Rwanda, Senegal, South Africa, Tanzania, Tunisia, Uganda, Zimbabwe), South America and the Caribbean (Bolivia, Cuba, Ecuador, Haiti, Peru), Southeast Asia (Cambodia, Indonesia, Nepal, Philippines, Vietnam), Asia (Palestinian territory). Người Palestine được chấp nhận dù không cư trú tại 31 quốc gia hợp lệ",Có,"aquaculture, health, food technology, economics, international development, GIS, information technology, agriculture, environment, human rights, microfinance",Bằng Cử nhân,Không yêu cầu,Không,Yêu cầu chặt chẽ,2.0,0.0,Không có thông tin,Không bắt buộc,Không,Không,Không yêu cầu,Không yêu cầu,,,Cam kết trở về,"Mỗi năm, ARES mang đến cơ hội theo học chương trình cử nhân nâng cao hoặc thạc sĩ, hoặc khóa đào tạo ngắn hạn từ 2 đến 6 tháng tại các cơ sở giáo dục đại học thuộc Liên đoàn Wallonia-Brussels, Vương quốc Bỉ.","Tạo tài khoản trực tuyến GIRAF
Điền và nộp đầy đủ đơn xin học bổng trên hệ thống
Hạn cuối nộp hồ sơ: 19/9/2025, 12h00 trưa (giờ Bỉ, UTC+1) → 17h00 cùng ngày giờ Việt Nam","Hạn nộp hồ sơ: 19/9/2025 lúc 17h00 (giờ Việt Nam)
",https://www.ares-ac.be/en/international-training-scholarships-2026-2027,False
UNIL Master’s Grants in Switzerland for Foreign Students - University of Lausanne,Trường,Thụy Sĩ,Toàn phần,"CHF 1,600/tháng trong 10 tháng/năm cho toàn bộ thời gian học thạc sĩ + miễn phí học phí cố định, trừ phí CHF 80/semester",Thường niên,9,2025-09-01 00:00:00,,10.0,True,"chỉ dành cho sinh viên quốc tế, chưa từng đăng ký tại UNIL",Có,"All Master’s programmes offered by UNIL, except:
Master from the School of Medicine
Master in Sciences and Practices of Education
Master of Law (except for specialisations: International and Comparative Law, Legal Theory, International Tax Law and Policy)
Master of Science in Physical Education and Sport Didactics
Master of Science in Health Sciences
Master of Science in Sustainable Management & Technology
Master of Science in Human Taphonomy
All MAS (3rd cycle programmes, Further Education programmes)","Bằng Cử nhân, Tương đương bằng Cử nhân",Không yêu cầu,Không,Yêu cầu chặt chẽ,0.0,0.0,"Tiếng Pháp, Tiếng Anh",Không bắt buộc,Không,Không,Không yêu cầu,Không yêu cầu,,,,Trường Đại học Lausanne (UNIL) tại Thụy Sĩ cấp học bổng UNIL Master’s Grants trên cơ sở cạnh tranh cho sinh viên quốc tế mong muốn theo học chương trình Thạc sĩ tại trường.,"Đơn đăng ký học bổng (cũng được tính là đơn xin nhập học thạc sĩ tại UNIL)
Bằng đại học (hoặc bằng tương đương với cử nhân của Thụy Sĩ)
Bảng điểm học tập
Minh chứng ngoại ngữ (C1 tiếng Pháp hoặc C1 tiếng Anh, tùy chương trình)
CV và các giấy tờ bổ sung (không có danh sách chi tiết đầy đủ trong bản tóm tắt, cần tham khảo website chính thức)
Biên lai đóng phí hành chính CHF 200","Tháng 9/2025: Mở đơn học bổng năm học 2026–2027
Hạn nộp hồ sơ: 1/11/2025 lúc 18:00 giờ Việt Nam (12:00 trưa giờ Thụy Sĩ)
Khóa học bắt đầu: Tháng 9/2026",https://www.unil.ch/unil/en/home/menuinst/etudier/mobilite-et-echange/etudiantes-et-etudiants-internationaux/etudiantes-internationaux-reguliers/bourses-master-de-lunil.html,False
Eric Bleumink Scholarships at University of Groningen,"Quỹ, tổ chức",Hà Lan,"Toàn phần, Sinh hoạt phí, Chi phí khác","học phí, chi phí đi lại quốc tế, sinh hoạt, sách vở, bảo hiểm y tế",Thường niên,,,2025-12-02 06:00:00,,True,"chỉ dành cho sinh viên từ các nước đang phát triển: Afghanistan, Angola, Bangladesh, Benin, Bhutan, Burkina Faso, Burundi, Cambodia, Chad, Comoros, Djibouti, Equatorial Guinea, Eritrea, Ethiopia, Gambia, Guinea, Guinea-Bissau, Haiti, Kiribati, Laos, Lesotho, Liberia, Madagascar, Malawi, Mali, Mauritania, Mozambique, Myanmar, Nepal, Niger, Rwanda, Sao Tome and Principe, Senegal, Sierra Leone, Solomon Islands, Somalia, Tanzania, Togo, Tuvalu, Uganda, Vanuatu, Yemen, Timor-Leste, Sudan (Rep.), Congo (Dem. Rep.), South Sudan, Central African Republic, Zambia, Armenia, Bolivia, Cape Verde, Congo (Rep.), Congo, El Salvador, Ghana, Honduras, India, Indonesia, Kosovo, Korea (Dem. Rep.), Kyrgyzstan, Moldova, Mongolia, Morocco, Nigeria, Vietnam, Uzbekistan, Ukraine.
trước 6:59 sáng ngày 1/12 Sinh viên phải được nhận (có điều kiện hoặc vô điều kiện) vào một chương trình Thạc sĩ của Đại học Groningen.",Không,All Master Programmes (MSc/MA/LL.M.) offered at University of Groningen,Bằng Cử nhân,Thành tích học tập xuất sắc,Không,Yêu cầu chặt chẽ,0.0,0.0,Tiếng Anh,Không bắt buộc,Thành tích học tập tốt,Không,Không yêu cầu,Không yêu cầu,,,Cam kết tham gia toàn bộ khóa học,Quỹ Eric Bleumink trao học bổng cho những sinh viên tài năng và các nhà nghiên cứu trẻ đến từ các nước đang phát triển. Học bổng được cấp cho chương trình Thạc sĩ kéo dài 1 năm hoặc 2 năm.,,,http://www.rug.nl/education/international-students/financial-matters/ericbleumink,False
