Türkiye Scholarships (Türkiye Bursları),Presidency for Turks Abroad and Related Communities (YTB),fund / organization,University,Includes admission & major placement; multiple levels available (AD/BA/MA/PhD),Türkiye Scholarships Online Application Portal,1–2,Head 1,End of 2 (depending on the year),Not published yet,yes,,Open to most nationalities (except Turkish citizens),—,no,All industries (depending on targets),High school (or equivalent) + UG track from Türkiye Bursları,High school (or equivalent) + UG track from Türkiye Bursları,Not stated,According to each level criteria,—,"Good academics, motivation, community activities",According to invitation letter and annual academic results,Online application + transcript + passport + essay + (possibly) interview,Online application + transcript + passport + essay + (possibly) interview,Submit on the system → selection → interview → reservation,https://www.turkiyeburslari.gov.tr/,"Official website announces subsidy levels 4,500/6,500/9,000 TL",yes,Not applicable,Not applicable,,,
Cambridge Commonwealth,European & International Trust Scholarships (The Cambridge Trust),fund / organization,Mainly partial tuition waivers (25%–100%) depending on university or major,Most are part-cost; value varies by program & partner,"~500 new scholarships/year; total 1,100–1,400 students currently benefiting; coordinated with many partners; has separate scholarships by nationality/major",Automatic/Cambridge Gateway application + “Trust’s Scholarship Search”,9–1 (PG) / 9–10 (UG),According to Cambridge landmark,According to Cambridge landmark,~500 new positions/year,,yes,International students admitted to Cambridge,—,,High school (or equivalent) + Cambridge pass (according to fund),High school (or equivalent) + Cambridge pass (according to fund),Bachelor's/Master's/PhD,Not stated,High profile ranking by Faculty/College,—,Excellent academic achievements,According to the conditions of each specific fund/scholarship,According to the conditions of each specific fund/scholarship,Cambridge Profile + Sponsorship Form (if required),Ứng tuyển Cambridge → xét tự động/đơn riêng tùy học bổng,https://www.cambridgetrust.org/scholarships,General information in the International Students section – Cambridge,yes,Not publicly available,Không công bố,,
Orange Tulip Scholarship (Vietnam stream),Nuffic (Study in NL) phối hợp các ĐH Hà Lan,fund / organization,Covers tuition or stipend (based on category),Managed by Neso/Study in NL; scholarship list & exemption levels vary by participating Dutch school,Application by school + submit through OTS contact,Multiple doses (usually 1–4),Depending on the participating Dutch school,Depending on the participating Dutch school,Not published yet,yes,,Only citizens of countries with OTS (including Vietnam); have never studied/worked in NL,—,yes,Only programs published by schools participating in OTS,High School (Vietnam) + invitation letter/conditions from OTS partner university in the Netherlands,High School (Vietnam) + invitation letter/conditions from OTS partner university in the Netherlands,Not stated,Conditional admission to the program in NL,—,Good academics; specific requirements vary by school,According to the invitation of each school,Admission documents + OTS documents of the school/contact person,Admission documents + OTS documents of the school/contact person,Apply for NL program → submit OTS according to the instructions of the school/contact person,https://www.studyinnl.org/finances/scholarships,"For example, OTS Vietnam page: view schools (e.g. Maastricht University)",yes,Not applicable,Not applicable,,,
Shell Scholarship (Undergraduate) – Nigeria,Shell Nigeria,fund / organization,"Full scholarship (through partner universities or NGOs): tuition, living expenses, airfare, comprehensive support",There are many categories (Secondary/University) for the local community; very large numbers each year at the high school level; the university level has its own branch,Application as per Shell Nigeria guidelines,6–9 (depending on the batch),Depending on the notification,Depending on the notification,Not published yet,yes,,Often prioritizing the community of Shell's operating area in Nigeria,Host states,Yes (by priority industry),Engineering/Science and related fields (depending on batch),High School (Nigeria) + nationality/major requirements,High School (Nigeria) + nationality/major requirements,Not stated,—,—,—,By invitation,Online application/through community contact,Online application/through community contact,https://www.shell.com.ng/sustainability/communities/education-programmes/scholarships.html,Bản tham chiếu để bạn đối chiếu khác quốc gia,yes,Not applicable,Not applicable, ,,,
Mastercard Foundation Scholars Program,Mastercard Foundation,fund / organization,Google (in cooperation with IIE),Apply directly to the school/partner unit on the list; benefits and schedule depend on each partner,Submit to partner school/NGO,Depends on the partner,Depends on the partner,Depends on the partner,Not published yet,no,,Mainly African nationals under the scope of the program,List of partners on the program page,no,Depends on each partner,High school (or equivalent) + admission to MCF partner school,High school (or equivalent) + admission to MCF partner school,Not stated,Meet the admission standards of partner schools,—,"Good academics, leadership, community involvement",According to the regulations of each partner,Admission application + scholarship application according to partner's instructions,Admission application + scholarship application according to partner's instructions,Select a school from the partner list → follow the instructions,https://mastercardfdn.org/en/what-we-do/our-programs/mastercard-foundation-scholars-program/,"Umbrella program, no common submission portal",yes,Not applicable,Not applicable,,,
Generation Google Scholarship (APAC),EMEA,fund / organization,Covers tuition and stipend (A-levels to university),Fund / Organization,"APAC: USD 2,500; EMEA: ~EUR 7,000; NA: USD 10,000 (1 year)","1-year support; criteria: academic achievement, leadership/contribution, financial need may be considered; some branches are for women in IT",Online application by region,2–5 (depending on the area),According to regional announcement,According to regional announcement,,Not published yet,yes,By school region (APAC/EMEA/NA),—,High school (or equivalent) + according to industry requirements/currently a student,High school (or equivalent) + according to industry requirements/currently a student,Computer Science/Software Engineering/Related,Bachelor,Not stated,Currently studying/wanting to study CS related major,Community/Technology Activities,"Strong academics, leadership, diversity & inclusion","Strong academics, leadership, diversity & inclusion",1 year; can reapply next season if qualified,Đơn online + bảng điểm + CV + bài luận (+ chứng minh tài chính nếu yêu cầu),Submit on Google/IIE regional portal,https://www.google.com/about/careers/applications/buildyourfuture/scholarships/generation-google-scholarship-apac,Amounts vary by region,yes,Không áp dụng,Không áp dụng,
Shell Scholarship (Undergraduate – Malaysia),Shell Malaysia,fund / organization,"Depends on district fund; may cover tuition, research, or short-term programs",Priority given to Engineering/Science/Commerce; very high SPM/O-level performance required; multiple rounds of assessment,Online application,4–5,By SPM result date,Rolling according to the announcement,Not published yet,yes,,Eligible candidates in Malaysia,—,yes,Engineering/Science/Business (depending on the year),High school (Malaysia) + related major,High school (Malaysia) + related major,Very high SPM/O-level scores,—,"Extracurricular activities, leadership","Strong academics, leadership, suitable for energy industry",According to contract/learning progress,Online application + multi-round evaluation,Online application + multi-round evaluation,Register on Shell portal → test/assessment → interview,https://www.shell.com.my/about-us/careers/students-and-graduates/scholarships.html,"For example, the Malaysian branch; Shell has many branches by country.",yes,Not applicable,Not applicable,,,
Rotary District Grants (Potential Undergraduate Funding),Rotary International (qua các District),fund / organization,"About 1,500 awards per year; stipend per BMBF scale (B/M) and €1,200/month plus allowance (PhD)","Small scale, short term (≥6 weeks to ≥1 year); apply through local Rotary Club/District",Submit through Rotary Club/District,Depending on District,Depending on District,Depending on District,Not published yet,yes,,Subject to District/Club regulations; not open to Rotarians/immediate family,—,no,All industries (depending on the proposal),High school (or equivalent) + according to local Rotary fund criteria,High school (or equivalent) + according to local Rotary fund criteria,Not stated,Aligns with Rotary's priority areas,Community activities,Commitment to community service and ethics,According to District funding regulations,District application form + Club recommendation letter,District application form + Club recommendation letter,Contact your local Rotary Club for grant sponsorship.,https://www.rotary.org/en/our-programs/scholarships,Level/cycle varies by District,yes,Not applicable,Not applicable,,,
Heinrich Böll Scholarships (All Levels – DE),Heinrich Böll Stiftung,government,"Up to USD 5,000 (plus up to USD 3,000 for Critical Need Language; plus USD 1,000 STEM supplement)","Requires German language proficiency (usually B2/DSH-2), social-environmental commitment; **NOT** open to international Bachelors in Germany (international undergrads are not eligible)",Online submission portal,3 & 9,~6 weeks before the gate opening date,March 1 & September 1,"~1,500/year",no,,No international Bachelor's applications accepted in Germany,—,no,—,Non-Bachelor's degree (mainly Master/PhD),Non-Bachelor's degree (mainly Master/PhD),—,—,—,—,—,For B/M/PhD only (not applicable for international Bachelor's degree),For B/M/PhD only (not applicable for international Bachelor's degree),—,https://www.boell.de/en/scholarships,Important: NOT applicable to international Bachelors,yes,Not applicable,Not applicable,,,
Benjamin A. Gilman International Scholarship Program,U.S. Department of State (ECA) – IIE,government,"One-semester exchange: tuition, housing, meals, airfare, insurance, stipend",For US citizens receiving Pell Grants for study abroad/credit-bearing internships; ~2 times/year,Gilman Online Application Portal,1 & 8–10,Between 1 (for term 3),3 &/or 10 head,"~3,000/year",no,,US citizens only; Pell Grant recipients,—,no,All majors (credit programs),Currently a university student in the US + US citizen/PR,Currently a university student in the US + US citizen/PR,Not stated,Receiving Pell Grant; progress is good,—,Persuasive essay; prioritize diversity/less popular destinations,According to the award conditions (once/lifetime),Online application + transcript + advisor certification,Online application + transcript + advisor certification,Submit portal → advisor confirmation → selection,https://www.gilmanscholarship.org/,Taken as a standard reference,yes,Not applicable,Not applicable,,,
Global Undergraduate Exchange Program (Global UGRAD),U.S. Department of State (ECA) – World Learning,fund / organization,Need-based support from partner universities for former UWC students,No degree granted; requires ≥1 year remaining at home school after graduation; includes Vietnam in the list,World Learning Portal/US Embassy,10–11 (VN usually 11),According to the announcement,End 12–1,Not published yet,yes,,Citizens of participating countries; ≥18 years old; full-time students; English proficiency required (training available),Vietnam is on the list,no,All majors (non-degree in the US),"Currently a university student (year 1-3) (exchange, no degree)","Currently a university student (year 1-3) (exchange, no degree)",Not stated,Full-time study; 1 year remaining in program,Community activities,"Good academics, adaptable, contributing",No renewal (1 term),Online application + transcript + essay + supporting documents,Online application + transcript + essay + supporting documents,Apply through World Learning/Embassy; interview; arrange school in the US,https://exchanges.state.gov/non-us/program/global-undergraduate-exchange-program-global-ugrad,According to the yearly calendar,yes,Not applicable,Not applicable,,,
Davis UWC Scholars Program,Davis UWC Scholars Program,fund / organization,"Full scholarship: tuition, college fees, stipend, IHS, airfare",Applicable at >100 partner universities in the US; only for alumni of 18 UWC schools; funded through school,No direct submission (reviewed through partner schools),—,—,—,Not published yet,yes,,Only 18 UWC alumni,—,no,All majors at partner universities,High School (UWC) + admission to partner university,High School (UWC) + admission to partner university,Not stated,Admitted to a partner university; need-based,UWC Activities/Values,Fit with UWC philosophy & good academics,According to the school's aid policy,Admission documents + financial documents at school,Admission documents + financial documents at school,Apply to partner universities on the list,https://www.davisuwcscholars.org/,VN qualifies if it is a former UWC,yes,Not applicable,Not applicable,,,
Jardine Scholarship (Undergraduate – Oxbridge),The Jardine Foundation,government,"Full scholarship: tuition, dormitory, insurance, airfare; allowance 4,500 TL/month (undergraduate)","Priority is given to Bachelor's degrees at 8 designated Colleges (Cambridge: Downing, Magdalene, Peterhouse, Trinity; Oxford: Exeter, Oriel, The Queen's, Trinity); eligible countries include Vietnam",Jardine online application + UCAS/Oxbridge submission,8–10,Between 8,End of 10–11,Not published yet,yes,,Citizens/long-term residents of countries where Jardines operates (including Vietnam),"ASEAN/East Asia (VN, TH, MY, ID, PH, KH, MM...), HK/TQ/DL",no,All majors at designated colleges,High school (or equivalent) + Oxbridge pass + leadership/nationality criteria,High school (or equivalent) + Oxbridge pass + leadership/nationality criteria,Not stated,Oxbridge admission criteria,Leadership/Social Activities,"Leadership, community, academic excellence",According to the invitation letter/scholarship conditions,Online application + essay + references + interview,Online application + essay + references + interview,UCAS/Oxbridge → apply to Jardine → interview,https://www.jardines.com/en/sustainability/our-focus-areas/shaping-social-inclusion/jardine-foundation,See Prospectus for college details & benefits,yes,Not applicable,Not applicable,,,
Türkiye Scholarships (Türkiye Bursları – Undergraduate),Presidency for Turks Abroad (YTB),fund / organization,University,Includes 1 year of Turkish (if required); admission arrangements,Türkiye Scholarships Online Application Portal,1–2,Head 1,End 2,Not published yet,yes,,Open to most nationalities (except Turkish citizens),—,no,All industries according to targets,High school (or equivalent) + UG track from Türkiye Bursları,High school (or equivalent) + UG track from Türkiye Bursları,Not stated,Criteria by level of education & profile,—,"Good academics, motivation, community activities",Renewal based on progress & performance,Online application + transcript + passport + essay + interview (if any),Online application + transcript + passport + essay + interview (if any),Submit on the system → interview → placement,https://www.turkiyeburslari.gov.tr/whyturkiyescholarships,"Subsidy level: 4,500 TL for Bachelor's degree",yes,Not applicable,Not applicable,,,
Cambridge Commonwealth,European & International Trust Scholarships (UG),fund / organization,Partial tuition waivers (25%–100%) depending on university or major,Mostly semi-divided; value varies by partner fund,"~500 new scholarships/year; support 1,100–1,400 current students; based on achievements and recommendations of the Faculty/College",Automatic/based on Cambridge profile (+ additional form if required),9–1 (PG) / 9–10 (UG),According to Cambridge landmark,According to Cambridge landmark,~500 new positions/year,,yes,International students admitted to Cambridge,—,,High school (or equivalent) + Cambridge pass,High school (or equivalent) + Cambridge pass,Bachelor,Not stated,High profile ranking by Faculty/College,—,Academic excellence,According to the conditions of each fund,According to the conditions of each fund,Cambridge Profile + (possibly) Trust form,Ứng tuyển Cambridge → xét tự động/đơn riêng tuỳ học bổng,https://www.internationalstudents.cam.ac.uk/applying/fees-and-financial-support,The Trust is the largest funder of international students in Cambridge.,yes,Not published yet,Chưa công bố,,
Orange Tulip Scholarship (Vietnam stream),Nuffic/Study in NL + các ĐH Hà Lan,university,Full tuition plus academic enrichment benefits; limited number available,Managed by Neso/Study in NL; categories & deadlines vary by school,Application by school + submit through OTS contact,1–4,Depends on the school,Depends on the school,Not published yet,yes,,Only citizens of countries with OTS (including Vietnam),—,yes,Only programs published by schools participating in OTS,High school (Vietnam) + passed OTS partner university in the Netherlands,High school (Vietnam) + passed OTS partner university in the Netherlands,Not stated,Conditional admission to the program in NL,—,Good academics; specific requirements vary by school,According to the invitation of each school,Admission documents + OTS set of school/contact person,Admission documents + OTS set of school/contact person,https://www.studyinnl.org/finances/scholarships,Theo từng trường Hà Lan tham gia OTS,yes,Not applicable,Not applicable, ,,,
Trustee Scholars Program – Boston University,Boston University,university,"USD 5,000–15,000 per year (Main Campus); USD 2,000–4,000 per year (Blue Ash/Clermont)",BU's most prestigious scholarship for new students; separate essay required,Separate application (with BU admission application),9–12,According to BU admissions schedule,According to BU admissions schedule,Not published yet,yes,,Eligible new international students,—,no,All Bachelor's Degrees at BU,High school (international) + passed Boston University,High school (international) + passed Boston University,Not stated,Excellent academic record + Trustee essay,"Activities, leadership","Top academics, leadership, innovation",Annual renewal if qualified,Common App + Trustee essay + supporting documents,Common App + Trustee essay + supporting documents,Consider international competition; interview (if any),https://www.bu.edu/provost/students/undergraduate/trustee-scholars-program/,"BU Aid: ~43% of undergraduates receive aid (H2, CDS 2024-25)",yes,"~43% (undergrad, 2024-25)","~$50,568 (CDS related items)",,,
International Outreach Award – University of Cincinnati,University of Cincinnati,university,"USD 6,000–28,000 per year (automatic, based on SAT/ACT and GPA)",Automatic review/or review based on profile; renewable,Automatic/based on admission records,8–2,According to UC milestone,According to UC milestone,Not published yet,yes,,International students are charged non-resident tuition fees.,—,no,All eligible majors at UC,High school (international) + passed Univ. of Cincinnati,High school (international) + passed Univ. of Cincinnati,Not stated,Meet admission requirements & academic achievement,—,Good academics,Renewal if conditions are met,GPA/profile + on-time admission,GPA/profile + on-time admission,Automatically applied to non-resident surcharge,https://admissions.uc.edu/information/international/finance/scholarship.html,Value depends on campus,yes,Not published yet,Not published yet,,,
International Freshman Scholarships – University of Alabama,University of Alabama,fund / organization,"Usually full or highly generous (tuition plus enrichment funds), varies by university",Multiple levels (Crimson Legends → Presidential); renewable as required,Automatic (by score & GPA),8–3,According to UA milestone,According to UA milestone,Not published yet,yes,,New international students main campus,—,no,All industries are eligible,High school (international) + passed Univ. of Alabama,High school (international) + passed Univ. of Alabama,3.5+ and/or SAT/ACT at appropriate level,By scale + test,—,Good academics,Annual renewal if conditions are met,Application form + standardized scores (if required),Application form + standardized scores (if required),Automatic review upon admission,https://afford.ua.edu/scholarships/international/,There are many levels of automatic scholarships.,yes,Not published yet,Not published yet,,,
Stamps Scholarship (network – theo trường đối tác),Stamps Scholars Program (với các ĐH đối tác),fund / organization,"CAD 120,000 (Engineering) or CAD 100,000 (Science/Math)","Each partner university determines the value, number of places, and its own process; most are automatically considered when applying to the partner school.",Automatic/internal review at partner school,8–1,By school,By school,Not published yet,yes,,Applicants applying to Stamps partner schools,—,no,All majors at partner schools,High school (or equivalent) + passing Stamps partner schools,High school (or equivalent) + passing Stamps partner schools,Not stated,Very high academic and leadership achievements,Leadership/Social Activities,"Academic excellence, innovation, service",By partner school,School admission documents + interview round (depending on school),School admission documents + interview round (depending on school),Reviewed through school; not submitted to center,https://www.stampsscholars.org/our-program/partner-schools/,Refer to the partner list,yes,Not applicable,Not applicable,,,
Schulich Leader Scholarships (Canada – STEM),Schulich Foundation (Canada),university,Full or need-aware (tuition plus living) – KMILOT/Donald A. Wehrung/International Impact/Vantage One categories,100 scholarships/year at 20 Canadian partner universities; **for Canadian citizens only**,Canadian High School Nomination + Portal Profile,10–1,According to the announcement,According to the announcement,100,no,,Canadian citizens only (not open to international students),—,yes,STEM (Engineering/Science/Math),High school (Canada) + passed Canadian university STEM major (nominating school),High school (Canada) + passed Canadian university STEM major (nominating school),Not stated,High profile ranking; school recommended,Activities/startups/leadership,"Spiritual entrepreneur, leader",By invitation; throughout the study period,High school nomination → submit to portal → review,High school nomination → submit to portal → review,https://schulichleaders.com/,Không phù hợp SV quốc tế VN (tham khảo),yes,Not applicable,Not applicable, ,,,
UBC International Scholars Program – UBC,University of British Columbia,university,"Three levels: AUD 10,000 (first year) or 50%/100% tuition waiver for full program (3 years)",Consider overall performance + financial need; extendable up to 4 years if qualified,School nomination + online application (with designation),9–11,According to UBC milestone,According to UBC milestone,Not published yet,yes,,International students applying to UBC,—,no,All industries are eligible,High school (international) + UBC (need/merit),High school (international) + UBC (need/merit),Not stated,Meet UBC admission requirements + demonstrate financial need,Community/Leadership Activities,Academic Excellence & Community Impact,Extend up to 4 years if UBC standards are met & still needed,Application form + scholarship package + financial proof,Application form + scholarship package + financial proof,Nominated by high school (depending on the situation) → submit to the portal → review and selection,https://you.ubc.ca/financial-planning/scholarships-awards-international-students/international-scholars/,4-program umbrella,yes,Not published yet,Not published yet,,,
Melbourne International Undergraduate Scholarship – University of Melbourne,University of Melbourne,university,"100% tuition waiver (8 semesters) plus living stipend ~KRW 300,000–350,000/month plus health insurance","Automatically considered based on international admission achievements; ~1,000 places/year (according to aggregated sources); renewable according to conditions",Automatic review,1–5,According to enrollment milestones,According to enrollment milestones,"~≥110 (by page) / ~1,000 (aggregate source)",yes,,International students applying to UoM,—,no,All Bachelor's degrees are eligible,High school (international) + University of Melbourne entrance exam,High school (international) + University of Melbourne entrance exam,Not stated,High academic achievement,—,Outstanding academic achievements,According to the conditions of each level (maintain achievements),UoM Admissions Application (no separate application required),UoM Admissions Application (no separate application required),Automatically review & notify via offer/account,https://scholarships.unimelb.edu.au/awards/melbourne-international-undergraduate-scholarship,Value depends on level,yes,Not published yet,Not published yet,,,
