ICCR Scholarships,Indian Council for Cultural Relations (ICCR),government,"Full scholarship: tuition, monthly allowance, airfare, insurance",Have **Undergraduate**; apply via **A2A** portal; multiple schemes (A1201…),**A2A** ICCR Gate,2–4,Around February 20,According to call,640 slot (A1201) 2025-26 (reference),yes,,Citizens of partner countries (including Vietnam),List by Embassy/TEO,no,All majors by school category,High school (or equivalent) + Indian university entrance exam (UG track available),High school (or equivalent) + Indian university entrance exam (UG track available),Not stated,According to the conditions of the receiving school,—,Academic/Motivation,According to the regulations,Sign up for A2A + profile,Sign up for A2A + profile,Embassy confirmation → ICCR review,https://a2ascholarships.iccr.gov.in/,Official A2A page,yes, , ,,,
Kemitraan Negara Berkembang (KNB),Indonesia – Kemdikbudristek,government,Tuition plus stipend (depending on program),Mainly traditional **Master/PhD**; some batches/units have limited UG,Online application + Embassy recommendation letter,2–5,According to call,According to call,Not published yet,yes,,Citizens of developing countries (including Vietnam),—,Limited,According to the list of KNB schools/majors,Unknown/not preferred UG (KNB usually Master/PhD),Unknown/not preferred UG (KNB usually Master/PhD),Not stated,According to annual call,—,Academics & Motivation,According to the regulations,Application + letter of recommendation + profile,Application + letter of recommendation + profile,According to call,https://knb.kemdiktisaintek.go.id/,See Guide every year,yes, , ,,,
Kazakhstan Government Scholarship (Bolashak/State grants),Kazakhstan – International Programs Center/ENIC,government,Tuition waiver plus dormitory plus basic allowance (varies by school),Primarily **for Kazakhstan citizens**; international student slots vary by year,Online application,6–8,According to call,According to call,Not published yet,Unknown,,Kazakhstan nationals preferred; international opportunities **unstable**,—,no,According to the program,Not Bachelor's degree (Bolashak mainly post-graduate),Not Bachelor's degree (Bolashak mainly post-graduate),Not stated,According to local regulations,—,Academics,According to the regulations,Online application,Online application,According to call,https://enic-kazakhstan.edu.kz/en/post/94,Official information for previous batch; status changes,Unknown, , ,,,
Russian Government Scholarship (Open Doors / Quota),Russia – Rossotrudnichestvo + Global Universities,government,"€10,000 plus full tuition waiver (one year)",**Quota** route via Rossotrudnichestvo; **Open Doors** mainly PG; UG via national quota,Online application (quota) / Open Doors,10–2,By country/representative,According to the representative,"~15,000 seats/year (quota)",yes,,International citizens (including Vietnamese),According to water standards,no,According to the list of Russian schools,Non-Bachelor's Degree (Open Doors: Master/PhD),Non-Bachelor's Degree (Open Doors: Master/PhD),Not stated,According to representative & school regulations,—,Academics,According to the regulations,Application through Rossotrudnichestvo/portal representative,Application through Rossotrudnichestvo/portal representative,According to call,https://od.globaluni.ru/,"UG via **quota**, Open Doors mainly PG",yes, , ,,,
GOI-IES (Government of Ireland – International Education Scholarships),Ireland – HEA,government / fund,Tuition waiver plus stipend (depending on university or program),**For Master/PhD**; not applicable to Bachelor's degree,Online application,1–3,According to call,According to call,60/year,no,,Non-EU/EEA requirements,—,no,—,Not Bachelor's degree (GOI-IES mainly Master's),Not Bachelor's degree (GOI-IES mainly Master's),Not stated,According to Master/PhD admission standards,—,Academics & Motivation,By invitation,Apply through HEA + school offer,Apply through HEA + school offer,According to call,https://hea.ie/policy/internationalisation/goi-ies/,Not applicable Bachelor,yes, , ,,,
Qatar Scholarships (multi-partner),Qatar Scholarships (EAA/đối tác & các ĐH tại Qatar),government,"HK$80,000 per year for non-local students (Outstanding Performance scheme)",There are **Undergraduate** at some schools (e.g. Lusail University) according to the category,Application through partner program/university,3–6,In batches,In batches,Not published yet,yes,,Citizens of developing countries (including Vietnam),By program,yes,By category of each school,High school (or equivalent) + according to program partner (conditions vary),High school (or equivalent) + according to program partner (conditions vary),Not stated,According to each university's criteria,—,Academics & Motivation,By program,University profile + scholarship form,University profile + scholarship form,By category,https://www.qatarscholarships.qa/,The Programs page lists the UG level,yes, , ,,,
HKSAR Belt and Road Scholarship (HKSAR GSF – Outstanding Performance),HKSAR Education Bureau,government,"Tuition waiver plus stipend CZK 12,000/month (pre-master’s level)",Administered by the **HKSAR Government Scholarship Fund**; some schools (e.g. HKU) have a full tuition **Belt and Road** at the school level,Nominated by schools in HKSAR,9–4,By school year,By school year,Thousands (total fund),yes,,"Non-local students studying in HK (full-time, accredited)",—,no,All industries are eligible,High school (international) + B&R nationality + university entrance exam in HK,High school (international) + B&R nationality + university entrance exam in HK,Not stated,Excellent academic achievements,—,Academics & Activities,Extension as prescribed,Nominating school + profile,Nominating school + profile,School review → EDB approval,https://www.edb.gov.hk/en/edu-system/postsecondary/local-higher-edu/publicly-funded-programmes/scholarship.html,HKU also has its own full tuition B&R line at the school level.,yes, , ,,,
Czech Government Scholarship (Developing Countries),Czech Republic – MEYS,government,Tuition waiver plus dormitory plus monthly stipend (varies by level),Mainly for **Master/PhD**; **Undergraduate** usually through Czech language preparatory course + Czech language teaching major,Online application,4–9,According to call,**09/30/2025** (for 2026/27),Hundreds,yes,,Citizens of developing countries (including Vietnam),Priority countries list,Limited,According to the priority industry list,High school (for Czech UG track; with preparatory) + national requirements,High school (for Czech UG track; with preparatory) + national requirements,usually Czech),Not stated,According to MEYS criteria & school,—,Academics/Potential,According to the regulations,According to the regulations,Online application + documents,Theo call,https://msmt.gov.cz/eu-and-international-affairs/government-scholarships-developing-countries,"Level **CZK 12,000/month**; deadline 09/30/2025",yes, ,,,
Romanian Government Scholarship (MFA),Romania – MFA,government,Category B (undergraduate): 100% tuition waiver plus insurance; Category A mainly for postgraduate,Open for **Bachelor/Master/PhD**; apply via the Study in Romania platform,Online application,1–3,According to call,According to call,Not published yet,yes,,Non-EU citizens (including Vietnam),—,no,All industries (some exclusions),High School (UG Romanian track + 1 year of language preparation),High School (UG Romanian track + 1 year of language preparation),Not stated,Average score ≥7/10 or **Good** rating,—,Academics & Motivation,According to the regulations,Portal Study in Romania + profile,Portal Study in Romania + profile,Submit portal → selection,https://scholarships.studyinromania.gov.ro/,MFA/Study in Romania page,yes, , ,,,
Shanghai Government Scholarship (SGS),Shanghai Municipal Government,government,"CNY 20,000 per year (College) or CNY 30,000 per year (Undergraduate) – partial",Apply through schools in Shanghai; there is a 1+4 Chinese program,Application to school in Shanghai,1–5,According to school call,According to school call,Not published yet,yes,,International students (non-Chinese),—,yes,According to the list of schools in Shanghai,High school (international) + university entrance exam in Shanghai,High school (international) + university entrance exam in Shanghai,Not stated,According to the school's admission criteria,—,Academics & Motivation,By invitation,School application + (if required) SGS form,School application + (if required) SGS form,By school,https://ies.ecust.edu.cn/en/msg.php?id=74,Class B applies UG: free tuition + insurance,yes, , ,,,
Jiangsu Jasmine Scholarship,Jiangsu Provincial Government,government,Full or partial tuition waiver,1 year validity; renewable; submitted through school in Jiangsu province,Application through school,3–6,According to call,According to call,Not published yet,yes,,International students at schools in Jiangsu,—,no,By school directory in Jiangsu,High school (international) + university entrance exam in Jiangsu,High school (international) + university entrance exam in Jiangsu,Not stated,According to school criteria,—,Academics,By invitation,Application + profile,Application + profile,By school,https://iso.usts.edu.cn/en/Scholarship/Jiangsu_Jasmine_Scholarship.htm,"Some sites say 30,000 CNY/year for UG",yes, , ,,,
Beijing Government Scholarship (BGS),Beijing Municipal Government (qua các ĐH),government,"Full scholarship: tuition, accommodation, monthly stipend, insurance, airfare","Register at universities in Beijing (PKU, BNU…); UG up to 4 years",Application to each school,3–6,By school,By school,Not published yet,yes,,International students apply to universities in Beijing,—,no,According to the school's industry,High school (international) + university entrance exam in Beijing,High school (international) + university entrance exam in Beijing,Not stated,By school criteria (score/ELP),—,Academics,By invitation,School application + BGS form,School application + BGS form,By school,https://english.beijing.gov.cn/studyinginbeijing/scholarshipapplications/202006/t20200617_1926391.html,PKU/BNU has detailed instructions for UG,yes, , ,,,
King Abdulaziz University Scholarship,King Abdulaziz University (Saudi Arabia),university,Tuition waiver plus possible allowance (depending on category),Open for **Undergraduate/Master/PhD**; apply online,Online application,8–10,According to call,According to call,Not published yet,yes,,International students,—,no,By KAU industry,High school (international) + King Abdulaziz University (UG available),High school (international) + King Abdulaziz University (UG available),Not stated,According to KAU criteria,—,Academics & Ethics,According to the regulations,Online application + academic documents + passport,Online application + academic documents + passport,Review & Notification,https://kau.edu.sa/page/scholarship,KAU site confirms UG/PG slots available,yes, , ,,,
Khalifa University Undergraduate Scholarship,Khalifa University (UAE),university,10 full tuition plus living stipend awards; 23 full tuition awards (per year),Applicable to international students & UAE citizens; terms & conditions as per annual notice,Online application,8–12,According to call,According to call,Not published yet,yes,,International or UAE students are eligible,—,no,Bachelor's Degree at KU,High school (international) + passed Khalifa University (UAE),High school (international) + passed Khalifa University (UAE),Not stated,According to KU admission standards,—,Good academics; English required,According to KU regulations,Online application + academic records,Online application + academic records,Submit via KU portal → review,https://www.ku.ac.ae/scholarships-undergraduate,See International Students section,yes, , ,,,
UCL Global Undergraduate Scholarship,University College London (UCL),university,"£6,500 or £13,000 per year (tuition waiver)",For international students from low-income backgrounds; based on **need** + academic record,Online application (after applying to UCL),1–4,According to the announcement,UCL set (e.g. 28/04/2025 17:00 BST),~33+ seats/year,yes,,Overseas fee; low income background,—,no,All full-time Bachelor's degrees,High school (international) + UCL pass (need-based/merit),High school (international) + UCL pass (need-based/merit),Not stated,Applied to UCL; demonstrate financial need,—,Academic achievement + financial need,According to study time,Scholarship application + financial proof,Scholarship application + financial proof,Submit online → selection,https://www.ucl.ac.uk/scholarships/ucl-global-undergraduate-scholarship,There are separate submission instructions.,yes, , ,,,
University of Bristol Think Big Scholarships (Undergraduate),University of Bristol,university,High-value international scholarships (varies yearly; usually partial to full tuition),Applicable for up to 4 years; applied to tuition fees,Private online application,1–4,According to the announcement,Due by installment (e.g. 10/04/2026 10:00 UK),Many seats/year,yes,,International students (Overseas) enrolling in UG,—,no,All UG disciplines are eligible,High school (international) + University of Bristol entrance exam,High school (international) + University of Bristol entrance exam,Not stated,Strong academic record,—,Academics & Motivation,Subject to award conditions,Online application + offer (or UCAS number),Online application + offer (or UCAS number),Submit Bristol Gate → review,https://www.bristol.ac.uk/students/support/finances/scholarships/think-big-undergraduate/,Bristol Flagship,yes, , ,,,
University of Westminster Full Scholarship,University of Westminster,university,Tuition plus living stipend (amount announced by Oxford each year),The scholarship list changes annually; **full** is not open every year.,Online application for each scholarship,1–3,According to the announcement,According to the announcement,Not published yet,yes,,International Students (Overseas),—,no,By industry/announcement period,High school (international) + University of Westminster entrance exam,High school (international) + University of Westminster entrance exam,Not stated,Depends on the scholarship,—,Academics + needs + potential,By scholarship,Application + essay + evidence,Application + essay + evidence,Submit on Westminster portal → review,https://www.westminster.ac.uk/study/fees-and-funding/scholarships,Annual inspection; level & area of ​​change,yes, , ,,,
Oxford Simon and June Li Undergraduate Scholarship,University of Oxford,university,From partial to full tuition; some include allowances,For students with **financial need** residing permanently in **developing countries in Asia**; 1 place (Humanities major),Separate application after UCAS submission,10–2,Cyclical,Cyclical,1,yes,,Residing in developing Asian countries (including Vietnam),List of countries according to Oxford site,Limited,Mainly **Humanities Division**,High school (international) + Oxford pass,High school (international) + Oxford pass,Not stated,Very high achievement + financial need,—,"Excellent academics, difficult circumstances",Annual renewal if qualified,UCAS + scholarship form + financial proof,UCAS + scholarship form + financial proof,Submit as per Oxford Support guidelines,https://www.ox.ac.uk/admissions/undergraduate/fees-and-funding/oxford-support/simon-and-june-li-scholarship,See “Am I eligible?”,yes, , ,,,
CUHK Entrance Scholarships,The Chinese University of Hong Kong (CUHK),university,100% subsidized tuition plus living/housing/other allowance (per announcement),**Automatically considered** based on entrance performance; separate scholarships based on special performance,**Automatic review** (some areas have application),9–6,According to CUHK milestone,According to CUHK milestone,Many seats/year,yes,,International students (non-local),—,no,Most of the UG industry,High school (international) + pass CUHK,High school (international) + pass CUHK,Not stated,Excellent entry point,—,Academics + Activities,Extension as prescribed,No application required (most) / separate form (some cases),No application required (most) / separate form (some cases),Automatic review & notification with offer,https://admission.cuhk.edu.hk/fees-financing-your-studies/scholarships/admission-scholarships-for-undergraduates-only/,Have scholarship under SNDAS/other,yes, , ,,,
Nanyang Scholarship (Nanyang Global Scholarship),Nanyang Technological University (NTU),university,Full tuition (up to 4 years) plus living/housing stipend and global/professional experience fund,Most prestigious scholarship for new international students; with interview,Online application with admission documents,10–1,According to NTU milestone,According to NTU milestone,Not published yet,yes,,International students; no major restrictions (exceptions),—,no,All UG majors at NTU,High school (international) + passed NTU/Nanyang,High school (international) + passed NTU/Nanyang,Not stated,Top academic achievement; strong CCA/leadership,—,"Academic excellence, leadership",Renewal if NTU standards are met,Application form + scholarship section,Application form + scholarship section,Shortlisted → interviewed,https://www.ntu.edu.sg/admissions/undergraduate/scholarships/scholarship-listings/detail/nanyang-scholarship,New name: Nanyang Global Scholarship,yes, , ,,,
SMU Global Impact Scholarship,Singapore Management University (SMU),university,"Full tuition, room and board, and fees plus 3 summer funding opportunities",Key program to nurture social impact leaders,Separate online application (after submitting to SMU),11–5,According to SMU milestone,According to SMU milestone,Not published yet,yes,,International/ASEAN students (by category) studying at SMU,—,no,Majors at SMU,High school (international) + SMU admission + interview/leadership,High school (international) + SMU admission + interview/leadership,Not stated,Very high academics; interview,—,"Leadership, global thinking, social responsibility",Extension as prescribed,Application + essay + interview,Application + essay + interview,Submit to SMU portal → review,https://admissions.smu.edu.sg/financial-matters/financial-aid/smu-global-impact-scholarship-award,Brochure/website detailing benefits,yes, , ,,,
Duke Karsh International Scholarship,Duke University,university,"Full tuition, room and board (8 semesters) plus mandatory fees; dual enrollment allowed",**Merit** Scholarships for International Students with Achievement and Global Impact,Application: tick interested + internal review process,8–1,According to Duke milestone,According to Duke milestone,Not published yet,yes,,**International students** only (no US citizenship/PR),—,no,All UG majors at Duke,High school (international) + Duke pass,High school (international) + Duke pass,Not stated,Excellent academic/activity record,—,"Academics, leadership, service",8 semester extension if qualified,Common App + essays + (interview if applicable),Common App + essays + (interview if applicable),Considered through OUSF,https://ousf.duke.edu/merit-scholarships/karsh-international-scholars-program/,The page outlines the scope of support.,yes, , ,,,
Robertson Scholars Program,Robertson Scholars Leadership Program (Duke & UNC),fund / organization,"Partial to full tuition plus housing and meals (e.g., Woodruff)",Full Leadership Scholarship at **Duke** or **UNC-Chapel Hill**,Private online application,8–11,According to the announcement,According to the announcement,Not published yet,yes,,Candidates admitted to Duke/UNC,—,no,All UG majors at Duke/UNC,High school (international) + Duke or UNC admission + leadership criteria,High school (international) + Duke or UNC admission + leadership criteria,Not stated,Outstanding Achievement & Leadership,—,"Leadership, community service",8 semester extension,Online application + multi-round interview,Online application + multi-round interview,Apply directly to the program → apply to the school at the same time,https://robertsonscholars.org/,Full-ride leadership scholarship,yes, , ,,,
Emory University Scholars Program,Emory University,university,Need-based grant (no loans); meets 100% of demonstrated need,**merit** scholarship program; require selecting “Scholar consideration” and submitting by the deadline,Application: via Common App (select Scholars),9–11,~November 1–November 15 (according to plan),According to Emory Scholar milestone,Not published yet,yes,,International students are eligible,—,no,All UG majors at Emory/Oxford College,High school (international) + passed Emory,High school (international) + passed Emory,Not stated,Top academic; leadership/contribution,—,"Academics, leadership, impact",Extension as prescribed,Common App + essays + (interview),Common App + essays + (interview),Reviewed by Emory Scholars Committee,https://apply.emory.edu/financial-aid/scholar-program.html,Official Scholars Program page,yes, , ,,,
Princeton University Financial Aid,Princeton University,university,MIT Scholarship (grant) based on financial need; about 58% of students receive; median ~$69.8k (2024–25),Applicable to **international students**; **need-blind** & **no-loan** policy,Submit aid application (PFAS/CSS/other),10–3,Cyclical,Cyclical,Unlimited,yes,,All citizens; based on financial need,—,no,All industries,High school (international) + Princeton (need-based),High school (international) + Princeton (need-based),Not stated,Academically qualified & financially qualified,—,Academic ability; financial proof,Annual renewal based on need,PFAS/CSS + financial documents,PFAS/CSS + financial documents,Submit according to Princeton FA instructions,https://admission.princeton.edu/cost-aid,"Admission/FA page confirms full-need, no-loan",yes, , ,,,
MIT Scholarships (need-based),Massachusetts Institute of Technology (MIT),university,"Need-blind for international students and meets 100% of need (grants + work, no initial loans)",Applicable to international students; evaluated through **CSS Profile** + financial records,Aid application (no separate scholarship application required),11–2,Cyclical,Cyclical,Unlimited,yes,,International students qualify need-based,—,no,All industries,High school (international) + pass MIT (need-based),High school (international) + pass MIT (need-based),Not stated,According to MIT's needs,—,Good academic standing; demonstrate need,Annual renewal,Fill out CSS + financial records,Fill out CSS + financial records,Submit according to SFS MIT guidelines,https://sfs.mit.edu/undergraduate-students/types-of-aid/mit-scholarship/,SFS page shows % and median,yes, , ,,,
Amherst College Financial Aid,Amherst College,university,Meets 100% of demonstrated need; need-blind for all nationalities,Very generous support policy; applicable to international students,Aid application (CSS/Amherst forms),10–2,Cyclical,Cyclical,Unlimited,yes,,International students,—,no,All industries,High school (international) + Amherst (need-based),High school (international) + Amherst (need-based),Not stated,According to Amherst needs,—,Good academics; financial need,Annual renewal,Fill out the aid application + documents,Fill out the aid application + documents,Submit according to Amherst FA instructions,https://www.amherst.edu/offices/financialaid/international_students,Need-blind international,yes, , ,,,
Dartmouth College Financial Aid,Dartmouth College,university,Need-based; meets 100% of demonstrated need for applicants requesting aid,The support package is mainly **grants** (no loans required),Application form (CSS/ISFAA...),10–2,Cyclical,Cyclical,Unlimited,yes,,International students,—,no,All industries,High school (international) + Dartmouth admission (need-based),High school (international) + Dartmouth admission (need-based),Not stated,According to Dartmouth needs,—,Good academics; financial need,Annual renewal,Fill out the aid application + documents,Fill out the aid application + documents,Submit according to Dartmouth FA instructions,https://financialaid.dartmouth.edu/apply-aid/international-students,International need-blind policy,yes, , ,,,
Stanford Financial Aid,Stanford University,university,100% tuition waiver for all admitted students; additional housing and meal aid based on need,No merit scholarships (except limited athletic); applies to international,Application form (CSS/ISFAA...),10–2,Cyclical,Cyclical,Unlimited,yes,,International students apply for aid with their application.,—,no,All industries,High school (international) + Stanford (need-based),High school (international) + Stanford (need-based),Not stated,According to Stanford needs,—,Good academics; financial need,Annual renewal,Fill out the aid application + documents,Fill out the aid application + documents,Submit according to Stanford FA guidelines,https://admission.stanford.edu/apply/international/index.html,Must apply for aid at the time of submission,yes, , ,,,
Berea College Tuition Promise,Berea College,university,"Full tuition plus housing and food (up to 8 semesters) plus $5,500 experience fund",All students receive the **Tuition Promise Scholarship**; International students receive 100% support for mandatory year 1 costs,Admission form + aid documents,8–1,Cyclical,Cyclical,Unlimited,yes,,International students are eligible for admission to Berea,—,no,All industries,"High school (international) + passing Berea (need-based, work-program)","High school (international) + passing Berea (need-based, work-program)",Not stated,According to the Berea policy,—,"Overcoming difficulties, good academic performance",Renewal if academic requirements are met,Application form + financial documents,Application form + financial documents,Submit as per Berea instructions,https://www.berea.edu/no-tuition/,‘No Tuition’ page & international section,yes, , ,,,
