Hamad Bin Khalifa University Scholarship,HBKU (Qatar Foundation),University,Tuition exemption/reduction + stipend (depending on college),Annually,Unknown,Unknown,Unknown,Unknown,yes,International,,According to HBKU college,According to the program,Bachelor,Bachelor's degree (or equivalent),Unknown,Unknown,Academic achievements,According to the terms of the scholarship,HS according to college requirements,Submit with application,https://www.hbku.edu.qa/en/scholarship,Scholarship policies are provided by each college.,yes, ,,,,
Mandela Rhodes Scholarship,Mandela Rhodes Foundation,Foundation / Organization,Full,"Tuition, living, leadership development",Annually,Unknown,Unknown,Unknown,Unknown,Yes (African citizens; VN: No),African citizens only,African citizens,Unlimited,Multidisciplinary (South Africa),Bachelor's degree (or equivalent),Unknown,Unknown,Optional,"Leadership, community service",According to the terms,Submit online via MRF,Two rounds of selection,https://www.mandelarhodes.org/scholarship/,For African citizens only.,yes,,,,
Skoll Scholarship (Oxford MBA),Skoll Center for Social Entrepreneurship – Saïd Business School (Oxford),University,Full/Partial,MBA tuition + living allowance (depending on the year),Annually,Unknown,Unknown,Unknown,Unknown,yes,International,,Management/Business (MBA),MBA Saïd,Bachelor's degree (or equivalent),Unknown,Unknown,Experience in creating social impact,"Social leadership, sustainable impact",According to the terms,Oxford HS + Skoll essay,Separate process associated with Oxford application,https://www.sbs.ox.ac.uk/schools/oxford-said/skoll-centre,Refer to the official Skoll center.,yes,,,,
JFUNU Scholarship (UNU-IAS),Japan),University,Fund / Organization,Monthly allowance,"~120,000 JPY/month for up to 24 months; tuition waiver possible",Annually,Unknown,Unknown,Unknown,Unknown,yes,International (priority for developing countries),,Sustainable development,Bachelor's degree (or equivalent),Bachelor,Unknown,Unknown,Unknown,Achievement + financial need,According to the terms,HS according to UNU guidelines,Submit via UNU portal,https://unu.edu/ias/msc-scholarships,For UNU-IAS programme only,Có,,,
SEARCA Graduate Scholarship,SEARCA (SEAMEO),Foundation / Organization,Full,"Tuition, living expenses, airfare, insurance, thesis support…",Annually,Unknown,Unknown,Unknown,Unknown,yes,SEAMEO member countries,yes,Agriculture & related industries,According to priority project,Bachelor's degree (or equivalent),Unknown,Unknown,Priority for civil servants/public employees,According to the terms,HS according to SEARCA,Submit online,https://www.searca.org/scholarships,Priority for Southeast Asia region.,yes, ,,,,
Queen Elizabeth Commonwealth Scholarship (QECS),Association of Commonwealth Universities (ACU),Foundation / Organization,Full,Tuition and living support (depending on host country),Annually,Unknown,Unknown,Periodic cycle (round),Unknown,yes,Commonwealth countries,CW nationality only,Unlimited,2 year Master in another CW country,Bachelor's degree (or equivalent),Unknown,Unknown,Unknown,"Achievements, commitment to development",According to the terms,Students through ACU gate,Submit online,https://www.acu.ac.uk/funding-opportunities/for-students/scholarships/queen-elizabeth-commonwealth-scholarships/,Must study in a CW country other than your own.,yes,,,,
Heinrich Böll Foundation Scholarship,Heinrich-Böll-Stiftung (Germany),Foundation / Organization,Monthly allowance + other support,According to Stiftung regulations,Annually,3 & 9 (regular),Unknown,Unknown,"About 1,000–1,500 places/year",yes,International,,Unlimited,Multidisciplinary,Bachelor's degree (or equivalent),Unknown,Unknown,Social – green – democratic activities,Achievement + social commitment,Extension by progress,Students according to portal,Register online by term,https://www.boell.de/en/scholarships,Deadline/slots vary by year.,yes,,,,
Konrad Adenauer Stiftung Scholarship (KAS),Konrad-Adenauer-Stiftung (Germany),Foundation / Organization,Monthly allowance + allowance,According to KAS regulations,Annually,Unknown,Unknown,Unknown,Unknown,yes,International (non-EU preferred),German B2 may be required,Unlimited,Multidisciplinary,Bachelor's degree (or equivalent),Unknown,Unknown,Experience & Social Commitment,Achievement + leadership,According to the terms,HS according to KAS instructions,Submit online/through partners,https://www.kas.de/en/web/begabtenfoerderung-und-kultur/auslaenderfoerderung,English information at KAS site.,yes,,,,
Friedrich Ebert Stiftung Scholarship (FES),Friedrich-Ebert-Stiftung (Germany),Foundation / Organization,Monthly allowance + health insurance + allowance,Support packages by level of education,Annually,Unknown,Unknown,Unknown,Unknown,yes,International (studying in Germany),German required,Unlimited,Multidisciplinary,Bachelor's degree + ≥2 years of full-time work experience,Unknown,Unknown,Social-democratic activities,Achievements + social commitments,According to the terms,HS according to FES,Submit online,https://www.fes.de/studienfoerderung/information-in-english,Foreign applicants must be studying in Germany.,yes,,,,
Churchill Scholarship (Cambridge),Winston Churchill Foundation of the United States,Foundation / Organization,Full/Partial,Tuition + living allowance (1 year) at Cambridge,Annually,Unknown,Unknown,Unknown,~18 scholarships/year,No (US citizens/universities only),Only students nominated by American universities,US institutions nominée,STEM at Cambridge,1 year MSc,Bachelor's degree (or equivalent),Unknown,Unknown,Optional,High STEM research achievement,According to the terms,Students from nominated schools,Submit through Foundation,https://www.churchillscholarship.org/,Limited to US students.,yes,,,,
Rhodes Scholarship (Oxford),Rhodes Trust,Foundation / Organization,Full,Tuition + living expenses for 2 years (depending on standard),Annually,Unknown,According to constituency,According to constituency,Unknown,Yes (depending on ‘Global’/region; VN: by global channel),By region/nationality,Quota by constituency,Unlimited,Multidisciplinary at Oxford,Bachelor's degree (or equivalent),Unknown,Unknown,Optional,"Leadership, community service, excellence",According to the Rhodes statute,Online HS through Rhodes House,Two rounds/Interviews,https://www.rhodeshouse.ox.ac.uk/scholarships/the-rhodes-scholarship/,See Global/SEA track.,yes,,,,
DeepMind Scholarship (AI/ML),Google DeepMind (through partner universities),Foundation / Organization,Full/Partial,Tuition and living expenses sponsorship (depending on partner school),Annually,Unknown,Unknown,Unknown,Unknown,yes,By partner school,Limited target group (diversity),AI/CS related,Master related to AI,Bachelor's degree (or equivalent),Unknown,Unknown,Optional,"AI potential, diversity & inclusion",By university,HS at Partner University (nominated),According to partner university,https://deepmind.google/about/education/,"For example: UCL, ITU, etc.",yes,,,,
Hitachi Scholarship Foundation,The Hitachi Global Foundation,Foundation / Organization,Full/Partial,Previous Fellowship Program for Asian Lecturers/Researchers,Not fixed,Unknown,Unknown,Unknown,Unknown,yes,Asia (depending on the program),yes,STEM/Social Sciences (depending on the program),After University,Bachelor's degree (or equivalent),Unknown,Unknown,Teaching experience/NCV,According to the program,Students follow instructions,According to the announcement,https://www.hitachi-zaidan.org/global/,Many old shows (1985–2020); now focusing on awards & networks.,Unknown, ,,,,
Fundación Carolina Scholarship,Fundación Carolina (Spain),Foundation / Organization,Full/Partial,Tuition + living allowance (depending on scholarship),Annually,Unknown,Unknown,Unknown,~700+ places/year,yes,Mainly Ibero-American,Ibero-American nationality,Multidisciplinary,Bachelor,Bachelor's degree (or equivalent),Unknown,Optional,Achievement + motivation,According to the terms,Portal FC,Submit online,https://www.fundacioncarolina.es/,Mainly for Latin America/Ibero.,yes, ,,,,
OPEC Fund/OFID Scholarship,OPEC Fund for International Development (OFID/OPEC Fund),Foundation / Organization,Pause,The program is being restructured and is currently **not accepting applications**,Pause,,,,0,Unknown,International,,Unlimited,Multidisciplinary,Bachelor's degree (or equivalent),Unknown,Unknown,Unknown,Not applicable,Not applicable,Not applicable,https://opecfund.org/what-we-offer/special-initiatives/scholarship,The official website announces the temporary suspension of applications.,, ,,,,
East-West Center Graduate Degree Fellowship,East-West Center (Hawai‘i,Government,Fund / Organization,Full/Partial,UH Mānoa tuition + living expenses (depending on package),Annually,Unknown,Unknown,Unknown,Unknown,yes,International (Asia-Pacific),USA),,Bachelor's degree (or equivalent),Multidisciplinary (UH Mānoa),Bachelor,Unknown,Unknown,Optional,"Leadership, participation in the EWC community",According to the terms,HS according to handbook,Submit via Submittable portal,https://eastwestcenter.submittable.com/submit/86c3a9e1-6f03-4ed8-a448-c0334d86ab1c/graduate-degree-fellowship-2026,Link đợt 2026,Có,,
WHO/TDR Postgraduate Scholarship (Implementation Research),TDR – UNICEF/UNDP/World Bank/WHO Special Program,Foundation / Organization,Full,"Tuition, living, research, airfare",Annually,Unknown,Unknown,Unknown,Unknown,yes,LMICs (depending on the host school),Nationality limit according to host school,Tropical Medicine/IR,Implementation Research (public health),Bachelor's degree (or equivalent),Unknown,Unknown,Priority given to LMIC candidates,Achievements + commitment to public health,According to the terms,Students follow the host school,Submit through partner school,https://tdr.who.int/home/our-work/strengthening-research-capacity/postgraduate-training-scheme,For example Wits SPH – South Africa.,yes,,,,
ICTP Master Scholarship (MHPC),ICTP & SISSA (Trieste,Government,Fund / Organization,Full (for applicants from developing countries),Tuition + living expenses + airfare (depending on the class),Annually,Unknown,Unknown,Unknown,Unknown,yes,International (LMIC priority),,STEM/CS,Bachelor's degree (or equivalent),Bachelor,Unknown,Unknown,Optional,Good programming/computer science background,On schedule,HS according to MHPC/ICTP,Submit online,https://www.ictp.it/opportunity/master-high-performance-computing,MHPC Program,Có,,,
, ,, , , , , , , , , , , , ,Bachelor's degree (or equivalent), , , , , , , , , , ,,,,
Chevening Scholarship,UK FCDO & partners,Government,Full,"Tuition, living allowance, airfare, visa fees…",Apply online yourself via Chevening,Q3–Q4,Unknown,Unknown,"~1,500+ global/CY",yes,Citizens of eligible countries,List of Chevening countries,Unlimited,All subjects in the UK,Bachelor's degree (or equivalent),Not stated,Not stated,"≥2 years (≈2,800 hours) of experience","Leadership, networking, career ambition",According to Chevening regulations,Online application + recommendation letter + school offer,Apply on Chevening portal,https://www.chevening.org/scholarships/,Vietnam page has its own section,yes,,,,
Australia Awards Scholarships (AAS),DFAT (Australia),Government,Full,"Tuition, living expenses, insurance, airfare, other support",Self-submission online + national focal point,Q4–Q1,Unknown,Unknown,"1,500+ (2025 global)",yes,Regional Partners,55 partner countries,According to the priority list of each country,All majors at partner Australian universities,Bachelor's degree (or equivalent),Not stated,According to the regulations of each country,Prioritize relevant development experience,"Achievements, leadership potential, commitment to return",According to AAS regulations,Online application + required documents,Submit via OASIS/AAS system,https://www.dfat.gov.au/people-to-people/australia-awards/australia-awards-scholarships,Portal overview: australiaawards.com.au,yes,,,,
Fulbright Vietnamese Student Program,US Department of State (PAS – US Embassy Hanoi),Government,Full,"Tuition, airfare, living expenses, insurance, SEVIS fees…",Submit online according to Embassy instructions,Q1,Unknown,According to annual announcement,~20–40 (reference),yes,Vietnamese citizens,Vietnam,Unlimited,Master at American University,Bachelor's degree (or equivalent),Not stated,Not stated,Experience/community service preferred,"Strong academics, English, suitable for VN-US goals",According to Fulbright regulations,Online application + essay + recommendation letter,Submit according to US Embassy Vietnam instructions,https://vn.usembassy.gov/fulbright-vietnamese-student-program/,2026-2027 announcement page with specific milestones,yes,,,,
Manaaki New Zealand Scholarship,New Zealand MFAT (Manaaki),Government,Full,"Tuition, living expenses, insurance, airfare; other support",Self-submit online,Q1–Q2,Unknown,Unknown,Not stated,yes,Citizens of eligible countries,List of MFAT partners,According to NZ sector priorities,"Development, agriculture, climate, health…",Bachelor's degree (or equivalent),Not stated,Not stated,Prioritize leadership skills,"Development impact, water commitment",According to Manaaki regulations,Online profile,Submit on Manaaki portal,https://www.nzscholarships.govt.nz/,See also NZ schools page,yes,,,,
Government of Ireland International Education Scholarships (GOI-IES),HEA (Ireland),Government,"€10,000/year + full tuition waiver for the academic year",Scholarships for NFQ 9–10 (Master/PhD) at Ireland campus,Self-submit online,Q1–Q2,According to annual call,According to annual call,~60 seats/year,yes,Open globally,,Unlimited,All sectors at the Ireland campus are accepted.,Bachelor's degree (or equivalent),Not stated,Not stated,Optional,"Strong academics, motivated, goal-oriented",According to HEA regulations,Online application + school invitation/nomination letter,Submit on HEA portal,https://hea.ie/policy/internationalisation/goi-ies/,Call 2025 outlines timeline,yes,,,,
Study Scholarships – Master Studies for All Academic Disciplines (DAAD),DAAD (Germany),Foundation / Organization,Subsidies + other support,"Monthly stipend, insurance, allowance; tuition assistance possible",Self-submit online,Usually Q3–Q4,According to call,According to call,Not stated,yes,Open globally,,Unlimited,Master at German University,Bachelor's degree (or equivalent),Not stated,Not stated,Optional,Strong academics; foreign languages ​​(German/English),According to DAAD regulations,Online application + required documents,Submit on DAAD portal,https://www2.daad.de/deutschland/stipendium/datenbank/en/21148-scholarship-database/?detail=50026200,PDF call updated annually,yes,,,,
Erasmus Mundus Joint Masters (EMJM),European Commission – Erasmus+,Government,Full/Partial (depending on consortium),"Tuition, living expenses, insurance, transportation… (according to the program)",Submit directly to each EMJM,Q4–Q1,According to the program,According to the program,Not stated,yes,Open globally,,According to each EMJM,Multi-school link master,Bachelor's degree (or equivalent),Not stated,Not stated,Optional,Strong academics; program fit,According to the program,Students follow the instructions of each EMJM,Submit on the consortium's EMJM portal,https://erasmus-plus.ec.europa.eu/opportunities/opportunities-for-individuals/students/erasmus-mundus-joint-masters,Official overview page,yes,,,,
Orange Knowledge Programme (OKP),Nuffic (Netherlands),Foundation / Organization,Not applicable,Program ends 12/2024; summary page only,—,—,—,—,0,Unknown,Finished,—,—,—,Bachelor's degree (or equivalent),—,—,—,—,—,—,https://www.nuffic.nl/en/news/nuffic-phases-out-most-activities-outside-europe-after-the-orange-knowledge-programme-ends,Individual OKP page: results & summary,, ,,,,
France Excellence Eiffel Scholarship Program,MEAE & Campus France,Government,"Living allowance (Master: ~€1,200/month), health insurance, airfare... (not including tuition)","French schools nominate, do not accept direct applications",French school recommendation,Q4,"October 1, 2025","January 8, 2026",Not stated,yes,International candidates nominated by French institutions,,According to MEAE priority areas,Master/PhD,Bachelor's degree (or equivalent),Not stated,Not stated,Optional,Academic excellence; program fit,According to Eiffel rules,Profile through French school,The school submits to Campus France,https://www.campusfrance.org/en/france-excellence-eiffel-scholarship-program,Timeline 2026 announced,yes,,,,
MBA (National University of Singapore – NUS) Scholarships,NUS Business School (The NUS MBA),University,Partial/Full (depending on scholarship),Merit-based/industry packages (e.g. Derwin Pereira MBA Scholarship…),Self-submission (in parallel with MBA application),Q3–Q1,According to the selection round,Multiple milestones in a cycle,Package limits,yes,Open globally,,Business administration,MBA,Programmatic Exceptions,Not stated,Not stated,Work experience (MBA required),"Academics, leadership, career achievements",According to the program,HS MBA + scholarship essay,Apply on NUS MBA portal,https://mba.nus.edu.sg/admissions-and-funding/,Official NUS MBA Scholarship Page,yes,,,,
Invest Your Talent in Italy (IYT),MAECI (Italy),Government,Tuition exemption/reduction (partner school) + 9-month scholarship + internship,"Italian language course, business internship; only for partner schools",Self-submit online,Q4–Q1,According to call,According to call,Not stated,yes,Citizens of eligible countries,According to the list,According to the program at the partner university,Bachelor,Not stated,Not stated,Optional,Academics; foreign languages; motivation,According to IYT regulations,Online application + required documents,Submit on IYT/MAECI portal,https://www.esteri.it/en/opportunita/borse-di-studio/per-cittadini-stranieri/progetti-speciali/invest-your-talent-in-italy/,See more guidance from schools (e.g. UniPi),yes, ,,,,
Hungary Government Scholarship (Stipendium Hungaricum),Tempus Public Foundation (Hungary),Government,100% tuition exemption; housing/living support (level by level),Submit via TPF portal + sending partners,Self-submit online + sending partner,Q4–Q1,Usually open 11–12,Usually January 15 (depending on the year),Not stated,yes,According to the list of partners,According to bilateral agreement,All majors at partner schools,Bachelor's/Master's/PhD depending on level,Not stated,Not stated,Optional,Academics; foreign languages,According to TPF regulations,Online application + required documents,Submit on TPF system,https://stipendiumhungaricum.hu/,There is a Study in Hungary “Apply for…” page,yes, ,,,,
Japanese Government (MEXT) Scholarships – Research Students,MEXT (Japan),Government,Full,"Tuition, airfare, stipend; Embassy route & school route",Submit by yourself through the Embassy or school channel,Q2,Usually 4–5,According to the Consulate/Embassy of each country,Not stated,yes,By country,According to the Embassy/School announcement,PhD student/Master/Postgraduate,Bachelor,Not stated,Not stated,Often requires experience/research orientation,"Academics, research, English/Japanese",MEXT program,Profile according to national guidelines,Submit through Embassy or school,https://www.studyinjapan.go.jp/en/smap-stopj-applications-research.html,The local embassy website has its own calendar.,yes, ,,,,
Chinese Government Scholarships (CSC),China Scholarship Council (CSC),Government,Full/Partial,"Tuition free, dormitory/housing, living allowance (level by level)",Submit online (via CSC/school/Embassy),Q4–Q1,By national call,By national call,Not stated,yes,According to national quota,According to call,According to the program at Chinese University,Bachelor's/Master's/PhD depending on level,Not stated,Not stated,Optional,Academics; foreign languages ​​(HSK/IELTS…) by school,By area/progress,Online application + required documents,Submit on CSC portal or through Embassy,https://us.china-embassy.gov.cn/eng/lxfw/studyinchina/chinesegovernmentscholarship/,Look up campuschina.org,yes, ,,,,
Excellence Scholarship & Opportunity Programme (ESOP) – ETH Zurich,ETH Zurich,University,Full,Tuition + living expenses during the Master's program; mentorship,Self-submit (go with Master's application),11,"November 1, 2025","November 30, 2025",Not stated,yes,Open globally,,Master's programs at ETH,Bachelor,Not stated,Not stated,Optional,Academic excellence; research motivation,According to ETH regulations,Master Profile + ESOP Package,Submit on ETH portal,https://ethz.ch/students/en/studies/financial/scholarships/excellencescholarship.html,Timeframe 1–30/11/2025 (MEZ),yes, ,,,,
Knight-Hennessy Scholars (KHS) – Stanford University,Knight-Hennessy Scholars – Stanford,University,Full (up to 3 years),"Tuition, living, study, 1 flight/year",Self-apply online (parallel to Stanford application),Q3–Q4,According to KHS cycle,According to KHS cycle,~80–100+/year,yes,Open globally,,All graduate majors at Stanford,Bachelor,Not stated,Not stated,Optional,"Leadership, global citizenship, academic achievement",According to KHS regulations,KHS online application + Stanford application,Submit on KHS portal and Stanford portal,https://knight-hennessy.stanford.edu/program-overview/funding,The “Funding” page lists the benefits.,yes, ,,,,
Schwarzman Scholars – Tsinghua University,Schwarzman Scholars,Foundation / Organization,Full-time (1 year MGA),"Tuition, housing, living expenses, health insurance, research trips…",Self-submit online,Q1–Q2 & Q3–Q4,By international/Chinese batch,By international/Chinese batch,~150–200/year,yes,Open globally,,Master of Global Affairs (Tsinghua),Bachelor,Not stated,Not stated,Optional,"Leadership, community service, strong academics",According to program regulations,Online application + interview,Submit on the Schwarzman Scholars portal,https://www.schwarzmanscholars.org/,Official homepage,yes, ,,,,
Rhodes Scholarship – Oxford University,Rhodes Trust,Foundation / Organization,Full-time (usually 2 years),Tuition + living expenses; according to constituency (with Global scholarship),Self-filing online by region,Q2–Q3,According to constituency,According to constituency,~100+/year,Yes (via Global track),By country/track,According to constituency,All postgraduate courses at Oxford,Bachelor,Not stated,Not stated,Optional,"Leadership, service, academic excellence",According to the Rhodes statute,Online application + interview,Submit through the Rhodes House system,https://www.rhodeshouse.ox.ac.uk/scholarships/applications/global/,See age criteria/Global eligibility,yes, ,,,,
Gates Cambridge Scholarship,Gates Cambridge Trust,Foundation / Organization,Full,Full tuition and living expenses; ≈80 scholarships/year,Self-submit online (with Cambridge profile),Q3–Q4,By region,By region,~80/year,yes,Open globally,,PG at University of Cambridge,Bachelor,Not stated,Not stated,Optional,"Outstanding intellectual ability, committed to improving the lives of others",According to Trust regulations,Cambridge Profile + Scholarship,Submit through the Graduate Application Portal,https://www.gatescambridge.org/programme/the-scholarship/,2026 milestone opens from September 2025,yes, ,,,,
ADB–Japan Scholarship Program (JSP),Asian Development Bank (Japanese Government funded),Government,Full,"Tuition, living expenses (including housing), books, insurance, airfare; ~135 seats/year",Submit through partner school/ADB,Q4–Q1,According to call,According to call,~135/year (reference),yes,Eligible ADB member country citizens,List of countries + partner schools,Development/Economics/Management/Science & Technology,Bachelor,Not stated,Not stated,Relevant work experience,Good academics; committed to national development,According to ADB regulations,School/ADB Profile,Submit as per ADB/PI guidelines,https://www.adb.org/what-we-do/funds/japan-scholarship-program-jsp,Refer to “Participating Institutions” annually,yes, ,,,,
, ,, , , , , , , , , , , , , , , , , , , , , , , ,,,,
Ireland Fellows Programme – Asia,Department of Foreign Affairs (Ireland),Government,Full,"Tuition, airfare, living expenses, insurance, other support (1 year Master)",Self-submit online,Unknown,Unknown,Unknown,Unknown,yes,Eligible countries,By country list,According to Ireland's priority,Multidisciplinary (Master at HEI Ireland),Bachelor,Unknown,Unknown,Career experience (early/mid-career),"Leadership, commitment to development",According to program regulations,Online application + required documents,Submit on the program portal,https://irishaidfellowships.ie/strands/ireland-fellows-programme-asia.html, ,yes,,,,
McCall MacBain Scholarship - McGill University,McCall MacBain Scholars (McGill),Foundation / Organization,Full,"Tuition, living expenses, leadership development (up to 3 years depending on program)",Self-submit online,6–9,"June 1, 2025","August 20, 2025 (international applicants)",~80–100+/year,yes,Open globally,,Unlimited,All graduate programs at McGill,Bachelor,Unknown,Unknown,Optional,"Leadership, strong academics, community service",According to KMS regulations,Online profile + 2 references,Submit on KMS and McGill portals,https://mccallmacbainscholars.org/apply/, ,yes,,,,
University of Warwick – ASEAN–UK SAGE Women in STEM Scholarship,University of Warwick & British Council,Foundation / Organization,Full,"Tuition, living expenses for up to 12 months, return airfare, IELTS fee, visa, NHS surcharge",Self-submit online,Unknown,Unknown,Closed for 2025,5 seats (2025),yes,Female from ASEAN/Timor-Leste,ASEAN-UK SAGE,STEM,Master at Warwick (STEM),Bachelor,Unknown,Unknown,Optional,"Female, good academics, meet BC requirements",According to BC terms,Online application via Warwick,Submit according to scholarship instructions,https://warwick.ac.uk/study/scholarships-and-bursaries/scholarships/women-in-stem-scholarship/, ,yes,,,,
