Scholarship_Name,Scholarship_Organization,Scholarship_Type,Funding_level,Sponsorship Details,Application form,Application opening month (annual),Application start date,Application deadline,Scholarship slots,For Vietnamese students,Object limitation,List of restricted subjects (if any),Department restrictions,List of specific industries/groups,Required qualifications,Minimum GPA,Ranking requirements / field of study,Required experience,Competencies & Achievements (requirements.competencies),Scholarship renewal conditions,Required documents,Application process,Scholarship link (URL),Notes ,Annual (Yes/No/Unknown),,,,
Chinese Government Scholarship (CGS),China Scholarship Council (CSC),Government,Tuition exemption/reduction + dormitory + monthly living allowance + insurance,Multiple streams (Bilateral/University/Provincial/Type A–B–C); apply through Embassy/General Consulate (Type A) or school (Type B); have Master/PhD slots,Online application + nomination,12–4,According to call,According to call,Tens of thousands,yes,Citizens of all countries; according to the quota of each category,List of receiving schools/category A–B–C,,All majors at the school are accepted.,Bachelor's degree (or equivalent),Not stated,Meet the school's admission standards,—,Academic; HSK (if studying Chinese),According to CSC regulations,Online form + invitation letter (depending on the category) + academic records,Submit through Embassy (Type A) or school (Type B),https://www.csc.edu.cn/,CSC official portal in Chinese; see individual school instructions,yes,,,,
Turkiye Burslari (Turkey Government Scholarship),Presidency for Turks Abroad (YTB),Government,Full: tuition + dormitory + insurance + airfare; allowance ~TL/month according to level,Including placement in Turkish universities; Master/PhD available,YTB ​​Online Submission Portal,1–2,Begin 1,End 2,Not published yet,yes,Citizens of eligible countries (except TR citizens),List of countries,,All industries according to targets,Bachelor's degree (or equivalent),Not stated,According to program/university conditions,—,Academics & Motivation,Extension by progress,Online application + transcript + passport + essay + interview,Submit on YTB system → seat arrangement,https://www.turkiyeburslari.gov.tr/,Turkiye Scholarships official website,yes,,,,
Danish Government Scholarship (University of Southern Denmark – SDU),University of Southern Denmark (SDU),Government,Full tuition fee exemption + living allowance (level announced by SDU monthly),Only for **non-EU/EEA** admission to some Masters at the Sønderborg campus,Application via SDU (with/after application),10–2,According to call SDU,According to call SDU,Limit,yes,Non-EU/EEA to Master in Sønderborg,—,yes,Designated Master's programs (Engineering…),Bachelor's degree (or equivalent),Not stated,Achieve SDU qualifying offer,—,Strong academics,According to SDU invitation,Application form + scholarship form,SDU review and notification,https://www.sdu.dk/en/uddannelse/fees_and_funding/scholarships,SDU – Danish Government Scholarship page,yes,,,,
Bangkok Government Scholarship (Chulalongkorn University – Graduate),Chulalongkorn University,University,Usually free tuition + living/housing allowance (level according to each faculty's announcement),Graduate Scholarship Program for International/ASEAN Students; **official name at CU is often Graduate Scholarships for ASEAN/Non-ASEAN**,Online application according to CU/faculty announcement,2–10,According to call CU,According to call CU,Not published yet,yes,International/ASEAN students,—,,CU Designated Master's Programs,Bachelor's degree (or equivalent),Not stated,According to CU admission standards,—,Academics & Motivation,By invitation,Application + transcript + outline (if required),Submit via faculty/CU portal → review,https://www.chula.ac.th/en/academics/admissions/scholarships/,The name “Bangkok Government Scholarship” is rarely used officially; use CU scholarship,yes,,,,
Government of Brunei Darussalam Scholarship,Brunei MFA,Government,Full: tuition + airfare + monthly BND allowance + dormitory + insurance,Have Master's degree at universities in Brunei,Online Application (BDGS),1–2,According to call,According to call,According to quota,yes,Citizens of eligible countries (including Vietnam),—,,By school/major list,Bachelor's degree (or equivalent),Not stated,According to the requirements of the receiving school,—,Academics & Foreign Languages,By invitation,BDGS application + documents,Portal MFA → review,https://www.mfa.gov.bn/Pages/scholarship.aspx,BDGS Official Website,yes,,,,
Stipendium Hungaricum (Hungarian Government Scholarship),Tempus Public Foundation (Hungary),Government,Full: tuition waiver + living allowance + dormitory + insurance,Have Master/PhD degree; apply online + through nominating agency,TPF Portal + nominated partners,11–1,According to call,According to call,">5,000 (whole program)",yes,Citizens of partner countries (including Vietnam),List of nominated partners,,According to Study Finder,Bachelor's degree (or equivalent),Not stated,According to sending country and school criteria,—,Academics & Motivation,Extension as prescribed,Portal + profile + nomination,Online → screening → offer,https://stipendiumhungaricum.hu/apply/,Official program page,yes,,,,
Government of Ireland – International Education Scholarship (GOI-IES),Higher Education Authority (Ireland),Government,"€10,000 + full tuition fee waiver/year (1 year)",**Master/PhD** apply; non-EU/EEA required; highly competitive (~60 places/year),HEA Online Application,1–3,According to call,According to call,~60/year,yes,Non-EU/EEA citizens,—,,By industry at the receiving HEI,Bachelor (requires invitation/offer to study Master at University in Ireland),Not stated,Meet HEI offer/conditions,—,Academics & Motivation,No renewal (1 year),Online application + proof,HEA review & announcement,https://hea.ie/policy/internationalisation/goi-ies/,Only 1 year sponsorship,yes,,,,
Italian Government Scholarship (MAECI),Italian Ministry of Foreign Affairs (MAECI),Government,Allowance **€1000/month** + exemption/reduction of some fees; insurance,**No standard Bachelor's funding**; **Master's/PhD/AFAM/Language Course** applies,“Study in Italy” Gate,4–5,According to call,~Middle 5,Not published yet,yes,Foreign/Italian citizens living abroad,—,Limited,By program category,Bachelor's degree (or equivalent),Not stated,According to school conditions,—,Academics & Motivation,By invitation,Application + profile on the portal,MAECI by call,https://www.esteri.it/en/opportunita/borse-di-studio/per-cittadini-stranieri/borsestudio_stranieri/,Official call every year,yes,,,,
Tianjin Government Scholarship (Master),Tianjin Municipal Government (via school),Government,Tuition exemption/reduction (full/partial) + insurance; some schools have subsidies,Apply through universities in Tianjin (e.g. Tianjin University),Application through the receiving school,1–6,According to school call,According to school call,Not published yet,yes,Non-Chinese international students,—,yes,By school directory in Tianjin,Bachelor's degree (or equivalent),Not stated,According to university criteria,—,Academics,By invitation,School application + TGS form,By school,https://www.tju.edu.cn/english/Admission/Tuition_Scholarships/Scholarships/,"For example, Tianjin University (TGS) page",yes,,,,
Master Mind Scholarship (Government of Flanders),Government of Flanders,Government,"**€9,600/year** + **tuition fee exemption/reduction** (level according to HEI)",HEI in Flanders nominates; Master’s applies,**Nominated** by Flanders School,12–2,According to call,According to call,~150/year,yes,International applicants for Master's studies in Flanders,—,,By industry/receiving HEI,Bachelor's degree (or equivalent),Not stated,Top profile ranking; English/HEI requirements,—,Academic excellence,By invitation,Nominated by school + apply online,HEI nomination → Gov review,https://www.studyinflanders.be/scholarships/master-mind-scholarships,Study in Flanders official website,yes,,,,
Colombia Government Scholarship (for foreigners),ICETEX (Colombia),Government,Free tuition + living allowance + insurance + airfare (by call),Becas Colombia para Extranjeros: has Master's/Spanish courses,ICETEX Gate,3–6,According to call,According to call,Not published yet,yes,Citizens of countries (other than Colombia),—,Limited,By school/program category,Bachelor's degree (or equivalent),Not stated,As per school/ICETEX requirements,—,Academics & Motivation,According to call,Online application + documents,ICETEX review & announcement,https://portal.icetex.gov.co/Portal/Home/HomeEstudiante/becas-exterior/becas-para-extranjeros,ICETEX official website,yes,,,,
Thailand International Postgraduate Programme (TIPP),Thailand International Cooperation Agency (TICA),Government,Full: tuition + living allowance + airfare + insurance,According to the **subject/course** of the Thai ministry; candidates are nominated/recommended by state agencies,TICA Portal + Agency Nomination,1–3,According to call,According to call,Not published yet,yes,Priority is given to civil servants/public employees assigned by the agency.,—,yes,According to the development theme announced by TICA,Bachelor's degree (or equivalent),Not stated,According to each course criteria,Work experience,"Public service capacity, development",By invitation,TICA profile + nomination letter,Submit through the agency → TICA review,https://tica-thaigov.mfa.go.th/en/page/tipp,Development orientation program,yes,,,,
Kemitraan Negara Berkembang (KNB) Scholarship,Indonesia – Kemdikbudristek,Government,Full: tuition + monthly allowance + airfare + insurance,Mainly Master/PhD; some schools have language preparatory courses,KNB Portal + Embassy introduction letter,2–5,According to call,According to call,Not published yet,yes,Citizens of developing countries (including Vietnam),—,yes,By KNB school/major list,Bachelor's degree (or equivalent),Not stated,According to annual call,—,Academics & Motivation,According to the regulations,Online application + letter of recommendation,According to call,https://knb.kemdiktisaintek.go.id/,KNB Official Website,yes,,,,
Australia Research Training Program (RTP) Scholarships,Australian Government (through universities),Government,Tuition fee exemption (RTP Fees Offset) + **stipend** (level announced by the University),Apply for **Master by Research/PhD**; submit at **university** (no common portal),Application at the receiving university,Year-round (depending on university),By school,According to school,Not published yet,yes,International Students Master by Research/PhD,—,yes,Research fields by university,Bachelor's degree (or equivalent),Not stated,According to HDR admission standards,Study,Research achievements,According to university conditions,HDR profile + RTP form,Submit to University; University allocates RTP,https://www.education.gov.au/research-block-grants/research-training-program,Only **research Master/PhD**,yes,,,,
Azerbaijan Government Scholarship (Educational Grant for OIC/NAM),Government of Azerbaijan (MFA – AIDA),Government,Tuition free + living allowance + airfare + insurance,For citizens of **OIC/NAM** countries; have Master/PhD,Nominated by government agency + submitted according to instructions,1–6,According to call,According to call,Not published yet,yes,OIC/NAM Citizens,List of OIC/NAM countries,,According to the list of universities in Azerbaijan,Bachelor's degree (or equivalent),Not stated,As per program requirements,—,Academics & Motivation,According to the regulations,Application form MFA/AIDA,Submit through nominating agency → AIDA review,https://aida.mfa.gov.az/en/education,AIDA page – government scholarship program,yes,,,,
National Scholarship Programme of the Slovak Republic (NSP),Slovak Republic – SAIA,Government,Living/internship/teaching allowance; with Master's usually in the form of **exchange** (non-degree),Mainly supports **short-term exchange**; applicants apply individually,NSP Gateway,2–4 & 9–10,February 15–April 30 or September 1–October 31,According to call,Not published yet,yes,Foreign citizens,—,Limited,Exchange/visiting (not full Master),Bachelor's degree (or equivalent),Not stated,Invited/recognized by the host school,—,Academic ability; academic plan,According to the regulations,Application + invitation letter/receipt,Submit online → SAIA review,https://www.scholarships.sk/,Correct form of exchange/visiting,yes,,,,
Beijing Government Scholarship (BGS – Master),Beijing Municipal Government (through universities),Government,Tuition exemption/reduction (full/partial) + insurance,Apply through universities in Beijing (PKU/BNU…); Master's maximum 2–3 years,Application through the receiving school,3–6,According to school call,According to school call,Not published yet,yes,Non-Chinese international students,—,,According to the major of the receiving school,Bachelor's degree (or equivalent),Not stated,According to university criteria,—,Academics,By invitation,School application + BGS form,By school,https://english.beijing.gov.cn/studyinginbeijing/scholarshipapplications/,Beijing Municipal Government Website (English),yes,,,,
Romanian Government Scholarship (MFA/Study in Romania),Romania – MFA,Government,Tuition-free + accommodation + level-based allowance; study in **Romanian** (with preparatory year),Have Master/PhD; submit on Study in Romania portal,Online portal,1–3,According to call,According to call,Not published yet,yes,Non-EU citizens,—,,According to annual targets,Bachelor's degree (or equivalent),Not stated,Average score ≥7/10 or **Good** rating,—,Academics & Motivation,According to the regulations,Portal + profile,Online → review → notification,https://scholarships.studyinromania.gov.ro/,Study in Romanian is required except in exceptional circumstances.,yes,,,,
Swedish Institute Scholarships for Global Professionals (SISGP),Swedish Institute,Government,"Full: tuition + **SEK 12,000/month** + insurance + airfare + SI network",**Master’s** only; work experience & leadership required,SI application + UniversityAdmissions.se profile,1–2,According to call SI,According to call SI,~350–400/year,yes,Citizens of countries in the SI list,List of countries by year,yes,According to the eligible Master category,Bachelor's degree (or equivalent),Not stated,"Minimum work experience (usually ≥3,000 hours)",Work experience,"Leadership, sustainability, social impact",No renewal (1–2 years per program),SI application + supporting documents,According to SI & UA.se calendar,https://si.se/en/apply/scholarships/swedish-institute-scholarships-for-global-professionals/,SISGP Official Website,yes,,,,
Global Korea Scholarship (GKS),NIIED (Republic of Korea),Government,Full: tuition + living allowance + dormitory + airfare + insurance,**Embassy** and **University** lines; have Master/PhD + 1 year of Korean (regular),Online/Paper Application + Nomination,2–4,According to NIIED/Embassy call,According to call,"~>1,000 (whole program)",yes,Citizens of countries (including Vietnam),National & University Targets,,According to NIIED school catalog,Bachelor's degree (or equivalent),Not stated,According to NIIED/University criteria,—,Academics & Motivation,According to the regulations,Application + track record,Embassy/University review → NIIED approval,https://www.studyinkorea.go.kr/ko/scholarship/GksGuide.do,GKS/NIIED Official Portal,yes,,,,
Czech Government Scholarship (Developing Countries),Czech Republic – MEYS,Government,"Tuition waiver + allowance **CZK 12,000–14,000/month** (depending on level)",Mainly Master/PhD (taught in Czech; with preparatory course),Online portal,4–9,According to call,**September 30** (for next school year),Hundreds,yes,Citizens of developing countries (including Vietnam),Priority list according to MEYS,Limited,By priority industry,Bachelor's degree (or equivalent),Not stated,According to MEYS criteria & school,—,Academics/Potential,According to the regulations,Online application + documents,According to call,https://msmt.gov.cz/eu-and-international-affairs/government-scholarships-developing-countries,MEYS official website,yes,,,,
Qatar Scholarships (multi-partner),Qatar Scholarships (EAA & Partner Universities),Government,Tuition waiver + allowance (depending on university/program),Some schools have Master's degrees; list by year,Application through partner program/university,3–6,In batches,In batches,Not published yet,yes,Citizens of developing countries,By program,yes,According to the list of majors of each university,Bachelor's degree (or equivalent),Not stated,According to each university's criteria,—,Academics & Motivation,By program,University profile + scholarship form,By category,https://www.qatarscholarships.qa/,QS Program Page,yes,,,,
Kazakhstan Government Scholarship (State grants/Bolashak – tham chiếu),Kazakhstan – IPC/ENIC,Government,Tuition waiver + allowance (depending on scheme),Primarily for **Kazakhstani citizens**; opportunities for international students vary by year,Online application,6–8,According to call,According to call,Not published yet,Unknown,Priority given to Kazakhstan citizens,—,Limited,According to scheme/University,Bachelor's degree (or equivalent),Not stated,According to local regulations,—,Academics,According to the regulations,Online application,According to call,https://enic-kazakhstan.edu.kz/en/post/94,According to current information; need to check specific call,Unknown,,,,
Russian Government Scholarship (Quota/Open Doors),Rossotrudnichestvo & Global Universities,Government,Free tuition + dormitory + basic allowance (depending on school),UG/Master/PhD via **quota** representative Rossotrudnichestvo; **Open Doors** mainly PG,Online application via representative/quota,10–2,By country/representative,According to the representative,"~15,000 (quota)",yes,International citizens (including Vietnamese),National indicators,,According to Russian school directory,Bachelor's degree (or equivalent),Not stated,According to representative criteria & school,—,Academics,According to the regulations,Application through representative/portal,According to call,https://od.globaluni.ru/,UG over quota; Open Doors leans towards PG,yes,,,,
Manaaki New Zealand Scholarships,New Zealand Ministry of Foreign Affairs and Trade (MFAT),Government,Full: tuition + living expenses + round-trip airfare + insurance + settlement support,For citizens of development partner countries; have a Master's degree (taught/research); priority given to development fields; requires a 2-year commitment to return home,Apply online via Manaaki portal,1–2,According to call,According to call,Not published yet,yes,Citizens of partner countries (including Vietnam depending on the year),List of countries by call,Limited,"Development sectors (sustainability, economics, health, education…)",Bachelor's degree (or equivalent),Not stated,Eligible for admission to NZ + English IELTS/TOEFL standard,≥1 year experience (preferred),"Academics, leadership, commitment to development",According to MFAT regulations,Online application + transcript + essay + language proof,Apply via Manaaki portal → interview → offer,https://www.nzscholarships.govt.nz/,“Check eligibility every year”,yes,,,,
Orange Knowledge Programme (OKP),Nuffic (Netherlands),Government,Short-term or full tuition + living expenses funding for Masters,For professionals from 55 countries working in development; program **ends 2024**,Application through Dutch universities,10–2,According to call,According to call,0,,For priority country experts only,List of countries,Limited,"By sustainable development sector (water, food, education…)",Bachelor's degree + work experience (candidates currently working/sent by the agency),Not stated,As per program requirements,≥2 years of working experience,Leadership and organizational capacity,No longer valid,—,—,https://www.studyinnl.org/scholarships/orange-knowledge-programme,Ended 2024,,,,,
VLIR-UOS Scholarships (ICP Master),VLIR-UOS (Flemish Universities Belgium),Government,Full: tuition + living expenses + insurance + airfare,For citizens of 29 partner countries; support for development-related Master's studies in Belgium,Application through ICP school,10–2,According to call,According to call,~100/year,Unknown,Citizens of partner countries (may not include Vietnam),List of countries published by VLIR-UOS,yes,According to the ICP Master program,Bachelor's degree (or equivalent),Not stated,According to the criteria of each program,Development experience (preferred),"Academics, commitment to development",According to the host school,Application + transcript + essay,Submit at school → VLIR-UOS review,https://www.vliruos.be/en/scholarships/6,Check nationality eligibility,yes,,,,
ARES Scholarships (Belgium),ARES – Académie de Recherche et d’Enseignement Supérieur,Government,Full: tuition + living expenses + insurance + airfare,Master's and Short Course Scholarships for Citizens of Developing Countries; Limited Country List,ARES Online Application,9–1,According to call,According to call,~200/year,Unknown,Priority country citizens only (VN may not qualify),ARES Country List,Limited,According to the ARES Master program catalog,Bachelor (ICP Master) **/ Master (Advanced Master – if choosing AM track)**,Not stated,As per program requirements,Work experience (preferred),Academics & Development Motivation,According to the regulations,Online application + documents,Submit on ARES portal,https://www.ares-ac.be/en/cooperation-au-developpement/masters-and-training-courses,Check eligibility every year,yes,,,,
Islamic Development Bank (IsDB) Scholarship Program,Islamic Development Bank (IsDB),Government,Full: tuition + living expenses + insurance + airfare,For citizens of IsDB member countries or Muslim communities; with a Master's degree; priority given to development sectors,IsDB Online Application,12–2,According to call,According to call,Not published yet,Unknown,Citizens of IsDB member countries or Muslim communities,IsDB Member List,yes,"By development sector (Economics, Health, STEM…)",Bachelor's degree (or equivalent),Not stated,As per program requirements,Experience (preferred),"Academics, leadership, social service",According to IsDB,Online application + documents,Submit via IsDB portal,https://www.isdb.org/scholarships,Need to check Vietnam eligibility,yes,,,,
Aga Khan Foundation International Scholarship,Aga Khan Foundation (AKF),Foundation / Organization,50% grant + 50% loan (for tuition & living expenses),"Only for citizens in countries where AKF operates (Asia, Africa) – not open to Vietnam",Application through AKF national office,3–5,According to call,According to call,Not published yet,,Only countries in the AKF network,List of AKF countries,Limited,According to the major accepted at the partner university,Bachelor's degree (or equivalent),Not stated,As per program requirements,Social experience or activities,Academic & Financial Need,According to AKF agreement,Application + financial proof + references,Through your local AKF office,https://www.akdn.org/our-agencies/aga-khan-foundation/international-scholarship-programme,50% grant / 50% loan,yes,,,,
Rotary Peace Fellowship,Rotary International,Foundation / Organization,Full: tuition + accommodation + airfare + internship,"For candidates with 3–5 years of peace/development experience; Master’s at Peace Centers (Duke, Bradford, Queensland, ICU…)",Apply online through Rotary District,2–5,According to call,According to call,~130/year,yes,All nationalities,—,yes,"Peace, development, public policy",Bachelor's degree + ≥2 years of full-time work experience,Not stated,Suitable for field and experience,≥3 years of experience,"Leadership, community service, peace",According to the course duration,Application + references + essay,Rotary District → Peace Centers review,https://www.rotary.org/en/our-programs/peace-fellowships,Highly competitive,yes,,,,
Joint Japan/World Bank Graduate Scholarship (JJ/WBGSP),World Bank (JJ/WBGSP),Government,Full: tuition + airfare + living allowance + insurance,For citizens of WB member countries (including Vietnam); Master's at designated partner universities,JJ/WBGSP Online Application,1–2 & 3–5,In batch 1/2,In batch 1/2,~150/year,yes,Citizens of WB member countries,List of partner programs,yes,By partner programs category,Bachelor's degree (or equivalent),Not stated,≥3 years of full-time work experience,Work experience,"Academics, commitment to development",According to call,Application + offer + proof of experience,Online → WB review,https://www.worldbank.org/en/programs/scholarships,There are 2 batches every year,yes,,,,Có
Asian Development Bank–Japan Scholarship (ADB-JSP),Asian Development Bank (ADB) & Government of Japan,Government,Full: tuition + airfare + living allowance + insurance,For ADB borrowing members (including VN); Master's at partner institutions,Application through partner school,1–4,According to call,According to call,~300/year,yes,ADB citizen borrowers,List of partner institutions,yes,"By ADB priority sector (economics, management, engineering)",Bachelor's degree (or equivalent),Not stated,Work experience ≥ 2 years after university,Development experience,Leadership and development,According to the lock period,Single field + ADB-JSP form,Submit through school → ADB review,https://www.adb.org/work-with-us/careers/japan-scholarship-program,List of partners updated annually,yes,,,,
